Job Title,Job Description,Location,Part-time,Full-time
Senior UX Designer -,"Senior UX Designer Salary: 55,000-65,000 base salary  benifits  Permanent role  Hybrid working - 2 days on average onsite per week  Location: Bristol, city centre  Our Digital consultancy clinet are looking for a Senior UX designer to join their growing design function!  Great opportunity to consultant public and private sector clients through the design and delivery process for a market leader in there field.  About you  You've got 3 years of experience and would consider yourself a solid senior and a bit of a UX generalist.You're adaptable and are as comfortable with a service design project as you are with interface design.You have a solid understanding of UX process. Maybe you worked on GDS projects but now want to deliver more interesting design work?You have experience across a variety of research techniques and can demonstrate how you've turned insight into game changing experience.Expert Figma and have experience implementing design systems.You're full of ideas and can demonstrate innovative thinking.You love to collaborate, want to be around people and are open-minded to other people's ideas.You're hungry for success, get satisfaction from great work - and you'll go the extra mile to deliver it.You're confident taking ownership of client accounts and project work.Ideally you have experience working in an agency and understand how to manage clients and conflicting priorities. Role overview Working alongside the Head of UX, you'll play a key role in delivering their award-winning work.   You'll bring your passion for getting it just right for users into the work - and through the whole studio. You'll be responsible for leading the UX on our biggest projects. You'll get to work on products that are used by thousands of people that makes a real difference.You'll have a huge variety in what you work on - could be an app to operate an EV, could be a military project, could be an interesting interface for a website. You'll enjoy the variety of work.You'll work closely with strong creative and strategy teams. You'll be solving some real strategic challenges and delivering interesting interfaces that will look fantastic in your portfolio.You'll collaborate with clients to show the value a considered UX process can bring.You'll guide mid-weights and juniors in their work to deliver digital experiences that are done right and really solve the users' (and clients') needs.  Skills and responsibilities Collaborate with clients  Work closely with our clients and client teams to understand their needs, their customers and help them to deliver better digital experiences. User centred design You champion the user with everyone on the project. You know how to design and run research, you understand what the findings mean - and the implications on creating a great solution. More importantly, you know when to use your own judgement. You're not  led solely by the data. You can devise smart new solutions and validate them too. Leading projects  Responsible for the vision, execution and final quality of large-scale projects.Map out and manage the tasks and ways of working to phase a project properly and bring it home smoothly, in collaboration with Delivery Managers, Tech Leads and Creatives.Day-to-day management of the UX tasks on one or more projects. Design and lead workshops. Bonus - If you can do this too, you're perfect for this role!  Confident building design systems and governance Figma.Working knowledge of GDS, running discovery and transitioning into Alpha/Beta.Happy in building out Service design and drawing out Experience Maps.Making clickable prototypes to test out user journeys and show clients our thinking. Please apply today and I'll give you a call to discuss the full details and next steps!  ",Bristol,False,True
Online Graphic Designer,"Online Graphic Designer Wanted for a Lifestyle RetailerAre you ready to bring your design prowess to the digital forefront? We're on the lookout for a dynamic Online Graphic Designer to join our team, reporting directly to the Head of Ecommerce, you will be responsible for creating and energising our website and  digital marketing visual materials that can really elevate our digital channel and engage our audience. Responsibilities:- Craft compelling assets for monthly commercial campaigns, SEO content, and engaging brand promotions.- Bring our six European websites to life with eye-catching banners, videos, and dynamic campaign pages.- Dive into the interactive realm of online design, leveraging video, GIFs, and animation to captivate our audience.- Customize visuals for diverse audience segments and digital marketing channels, ensuring maximum impact.- Coordinate translations for international audiences and collaborate with teams worldwide.The Ideal Candidate:- Holds a design-related degree or equivalent experience, bursting with creativity and vision.- Masters InDesign, Illustrator, Photoshop, and video production/editing like a digital virtuoso.- Thrives in a fast-paced environment, juggling multiple tasks with finesse and attention to detail.- A natural communicator who can spark inspiration and collaboration across teams and regions.Ready to unleash your creativity and make a mark in the digital landscape? Join us on this exciting journey and send your CV today!Mandeville is acting as an Employment Agency in relation to this vacancy.",London,False,True
Print/Graphic Designer," Job Title: Print/Graphic DesignerLocation: Birmingham - (Office based with flexibility)Salary: Up to 35,000 DOE We are looking for a skilled Design Print and Production Manager to oversee the creation, production, and printing of marketing materials for a leading wholesaler. The ideal candidate will have a strong background in graphic design and printing processes! Benefits:  Comprehensive benefits package.Professional development opportunities and growth plan.Dynamic and flexible work environment.Employee discounts on products. Responsibilities:  Manage the Print, Design  ProductionConceptualize and produce marketing materials and product packaging.Creative Design for Promotional Leaflets and CataloguesVideo Creation for Website and Social MediaManage production process from concept to completion.Coordinate with vendors and ensure quality standards.Maintain brand consistency across all materials. Requirements:  Bachelor's degree in graphic design or related field.4 experience in graphic design/creative design and print production.Proficiency in Adobe Creative Suite(Illustrator, Photoshop)Understanding of printing processes.Excellent communication and organizational skills.Packaging design knowledge is a plus. If you are interested in this role, please apply for immediate consideration and interview, and to receive further details about the role. You can contact me on or  Key Words:Print Designer, Product Designer, Creative Designer, Graphic Designer, Designer, Content Creator, Adobe, Adobe Creative Suite, Illustrator, Photoshop, Adobe After Effects, Design, Graphic Design, Graphics, Digital, Video Creation, Website Design, Social Media,  Brochures, Leaflets, Printing In Technology Group Ltd is acting as an Employment Agency in relation to this vacancy. ",Birmingham,False,True
Graphic Designer - £35k," Job Title: Graphic Designer Location: Lytham, UK (2/3 days in-office) Salary: 30,000 - 35,000 per annum (pro-rata) Are you a creative genius with a passion for design? Do you thrive in a collaborative environment where your ideas can flourish? If so, we want to hear from you! We are seeking a talented Graphic Designer to join our dynamic team in Lytham. This is a fantastic opportunity to showcase your skills and contribute to exciting projects in a supportive and innovative work environment. Responsibilities:  Design captivating visuals for a variety of mediums including print, digital, and webCollaborate with team members to develop creative concepts and solutionsTranslate ideas and concepts into engaging designs that effectively communicate our brand messageEnsure consistency and adherence to brand guidelines across all design projectsStay up-to-date with industry trends and best practices to continuously improve design quality Requirements:  Minimum of 2 years of professional experience in graphic designProficiency in Adobe Creative Suite (Photoshop, Illustrator, InDesign)Strong portfolio showcasing a range of design projectsExcellent communication and collaboration skillsAttention to detail and ability to manage multiple projects simultaneouslyKnowledge of print production processes is a plus Perks:  Competitive salary (30k-35k)Flexible work arrangements (2/3 days in-office)Collaborative and supportive work cultureOpportunities for professional development and growthConvenient location in Lytham with easy access to amenities If you are passionate about design and ready to take your career to the next level, apply now to join our team! Please submit your resume and portfolio demonstrating your design expertise. We can't wait to see what you bring to the table. We are an equal opportunity employer and value diversity in our team. ",Lytham St. Annes,False,True
Web & Graphic Designer," Are you looking for a fun, fast-paced and challenging environment to take your marketing career up a notch? You will have had experience working within an internal marketing role in a normal business, or perhaps have had experience working within a marketing agency, and are looking for a fresh challenge with a rapidly developing business. Don't be trapped in a marketing role within a normal business that can't provide you with the support and training you need to develop your career - join a marketing agency that's the right environment for you to flourish and develop a long-term future career. The Role Join our expanding team of creative professionals dedicated to excellence in web and graphic design. You will be at the forefront of website development, dedicated to creating engaging user experiences and visually compelling designs tailored to our clients'  specific needs. Your role will centre on designing website layouts and user interfaces, along with developing brand visuals that enhance the online presence of our clients. This focus on web design will require a deep understanding of user interaction, aesthetics,  and the technical aspects of web development. Your responsibilities will include a variety of tasks, with opportunities for further training:  Designing, building, and maintaining websites with a focus on user experience and design aesthetics.Enhancing website SEO through content optimisation and technical improvements.Designing graphics that are optimised for website use, and contribute to a cohesive and attractive website design. You We are looking for a creative individual with 1-2 years of experience in web and graphic design, possibly with a background in marketing. Ideal candidates will have:  Experience using WordPress and Elementor to design and manage websites.A strongportfolioshowcasing web design projects and graphic design skills.Proficiency in design tools such as Photoshop, InDesign, or similar applications.A passion for bringing creativity, innovation, and inspiration to every project.Exceptional attention to detail, taking pride in the quality of your work.Excellent English writing skills for crafting engaging content.Additional website-related experience, such as UI/UX design, is highly desirable. The Company Wingman is a Marketing Agency that specialises in supporting the needs of technology businesses around the world. We currently serve over 90 businesses across the UK, US, Canada, Australia, Singapore, and beyond. We are growing quickly and are therefore creating new opportunities for our team to develop and expand their roles. We are passionate about promoting from within and see very much the ongoing development of this role as our team continues to grow - into  a specialist focused position or a promotion for leadership responsibilities as we scale our departments. ",Braintree,False,True
Digital Graphic Designer," Digital Designer, Liverpool - 35k We are seeking a talented mid-weight digital designer to join a thriving retail company based in Liverpool.  In this role, you will be expected to create engaging digital assets for emails, web banners, social media campaigns, and online marketing initiatives. You will be a fundamental part in this exciting period of rebirth and growth for this incredible company.  If you have experience in UX/UI and wish to grow this skill set further, that would be a bonus but not essential. SKILLS  EXPERIENCE:  MUST HAVE 2-3 years’ experience.Excellent communication as well as attention to detail.Proficiency in Adobe frameworkHave a background or experience in ecommerce design BENEFITS INCLUDE:   Hybrid workingFree parking onsiteVibrant working environmentOpportunity to grow in the company Interested? APPLY or email: with your CV for more info! As an industry leading, nationwide Marketing, Digital, Analytics, IT and Design recruitment agency, we are continually receiving new assignments to work on, so keep a close eye on our website, Facebook, LinkedIn and Twitter pages for a full list of current  permanent and interim opportunities as well as marketplace news and fun stuff. Forward Role is operating as an employment agency. As an industry leading, nationwide Marketing, Digital, Analytics, IT and Design recruitment agency, we are continually receiving new assignments to work on, so keep a close eye on our website, Facebook, LinkedIn and Twitter pages for a full list of current  permanent and interim opportunities as well as marketplace news and fun stuff.Forward Role is operating as an employment agency. ",Liverpool,False,True
User Experience Manager," Job Title: User Experience Manager Location: Outskirts of Norwich Salary Range: 60,000 - 80,000 DOE Company: CloudScope are working with an online entertainment business based on the outskirts of Norwich, dedicated to providing top-notch entertainment experiences to users across the globe. Committed to continuous improvement and innovation in their products  and services. Job Description: As the User Experience Manager, you will play a crucial role in enhancing the overall user experience of the online platform. You will be responsible for strategically developing the product, identifying key user experience issues, and implementing improvements  to ensure a seamless and enjoyable experience for our users. Key Responsibilities:   Strategic Development: Lead the strategic development of the product to enhance user experience, focusing on areas such as post-purchase customer experience, payment processing, and international play.  Identify User Experience Issues: Conduct thorough analysis and research to identify key user experience issues across various touch-points of the platform.  Address User Experience Challenges: Collaborate with cross-functional teams including product development, design, and customer support to address identified user experience challenges effectively.  Develop Deep Knowledge: Develop a deep understanding of business processes and user flows within the platform to identify areas for improvement over the long term.  Continuous Improvement: Implement a continuous improvement mindset, regularly reviewing and optimizing user experience processes and features.  User Feedback Management: Gather and analyse user feedback through various channels to gain insights into user preferences and pain points, using this information to drive improvements.  Stay Updated: Stay abreast of industry trends, best practices, and emerging technologies in user experience design to ensure our platform remains competitive and user-friendly.  Requirements:  Proven experience in a user experience management or related role ideally within the online entertainment or gaming industry (But not essential)Strong understanding of user experience principles, methodologies, and best practices.Excellent analytical and problem-solving skills with the ability to translate insights into actionable strategies.Exceptional communication and collaboration skills, with the ability to work effectively across cross-functional teams.Experience in conducting user research, usability testing, and interpreting user feedback.Knowledge of regulatory requirements related to online entertainment, including safe gambling practices, is preferred but not mandatory. ",Wymondham,False,True
Senior Graphic Designer," Central Employment are working with a leading and established Digital Creative Agency based in central Newcastle, as they look to recruit a Senior Graphic Designer. As a Senior Designer, you'll have the opportunity to lead the charge in shaping the visual identity of clients, from renowned brands to emerging challenger brands. Key aspects of the Senior Graphic Designer:  Lead the development and evolution of brand identities for our clients, ensuring consistency, authenticity, and resonance across all touch points.Conceptualise and design intuitive, user-centric digital experiences that drive engagement, conversions, and brand loyalty.Provide strategic creative direction to cross-functional teams, guiding projects from concept to execution while maintaining a high standardCollaborate closely with fellow designers, copywriters, developers, and marketers to bring ideas to life. Mentor junior team members, fostering their growth and development.Stay abreast of industry trends, emerging technologies, and design best practices to continually push the boundaries of creativity and innovation. Experience required:  You have a solid portfolio showcasing your expertise in brand strategy, digital design, and creative direction, with a minimum of 5 years experience in a similar role.Proficiency in Adobe Creative Suite (Photoshop, Illustrator, InDesign), Sketch, Figma, or other relevant design tools. Experience with motion graphics and video editing is a plus.You possess a keen understanding of brand positioning, consumer behaviour, and digital marketing principles, allowing you to design with purpose and impact.You thrive in a collaborative environment, working seamlessly with cross-functional teams to turn ideas into reality.Strong verbal and written communication skills, with the ability to articulate your design rationale and collaborate effectively with clients and colleagues. ",Newcastle Upon Tyne,False,True
Senior Graphic Designer," Central Employment are working with a leading and established Digital Creative Agency based in central Newcastle, as they look to recruit a Senior Graphic Designer. As a Senior Designer, you'll have the opportunity to lead the charge in shaping the visual identity of clients, from renowned brands to emerging challenger brands. Key aspects of the Senior Graphic Designer:  Lead the development and evolution of brand identities for our clients, ensuring consistency, authenticity, and resonance across all touch points.Conceptualise and design intuitive, user-centric digital experiences that drive engagement, conversions, and brand loyalty.Provide strategic creative direction to cross-functional teams, guiding projects from concept to execution while maintaining a high standardCollaborate closely with fellow designers, copywriters, developers, and marketers to bring ideas to life. Mentor junior team members, fostering their growth and development.Stay abreast of industry trends, emerging technologies, and design best practices to continually push the boundaries of creativity and innovation. Experience required:  You have a solid portfolio showcasing your expertise in brand strategy, digital design, and creative direction, with a minimum of 5 years experience in a similar role.Proficiency in Adobe Creative Suite (Photoshop, Illustrator, InDesign), Sketch, Figma, or other relevant design tools. Experience with motion graphics and video editing is a plus.You possess a keen understanding of brand positioning, consumer behaviour, and digital marketing principles, allowing you to design with purpose and impact.You thrive in a collaborative environment, working seamlessly with cross-functional teams to turn ideas into reality.Strong verbal and written communication skills, with the ability to articulate your design rationale and collaborate effectively with clients and colleagues. ",Newcastle Upon Tyne,False,True
Senior Graphic Designer," If you are a Senior Graphic Designer with experience in running a team, we have a fantastic opportunity for you. Role Overview *Please note: this Senior Graphic Designer role is maternity cover and will be a nine-month fixed-term contract. Joining as a Senior Graphic Designer, you will lead and motivate a team of two designers to deliver a challenging schedule of design and creative projects. The team sits within the wider marketing team but is a key enabler and support to a multitude of stakeholders, functional areas, five distinct audiences/communities (customers, TCs, colleagues, suppliers, clients) and the overall brand, so an audience-centric  approach is essential. Key Accountabilities  People management and developmentCreative concept developmentCo-creative direction of brand photography and videoProject, workflow, and process managementAgency and freelancer briefing and management, as requiredCreation and supervision of the production of high-quality artwork, assets templates, and materials across a variety of digital and print channels, including digital publishing platform templates and videoEvent branding - supporting the events team in producing collateral, event materials, and theming.Defining asset and artwork management processes About You The marketing team is going through a growth period, and we're looking for someone with significant experience in a design or creative leadership role managing teams and workflows to deliver exceptional, timely results. You will be accustomed to working collaboratively with a small, busy team. This is a hands-on role that will require you to personally prepare high-quality design work across multiple channels, both digital and print, alongside the wider team and project  management. You'll bring creative flair, strong organisational and interpersonal skills, and a great eye for detail. As with every management role at Travel Counsellors, you will look for ways to drive efficiencies and improvements and won't be fazed by shifting priorities and the need to respond quickly yet creatively to market conditions. B2C and B2B experience is welcomed;  experience designing for a premium brand would be an advantage. Benefits  A competitive basic salary  annual company bonusFlexible hybrid working model (2 days home, 3 days office)Career development and promotional opportunities25 days holidays (increasing to 28 after 5 years of service)A Moments That Matter Day (annually)Enhanced maternity/paternity payHoliday buy and sell (up to 5 days per year)3 paid days charity leaveCompany events, socials, and incentives3x annual salary death in service benefitCompany pension schemeCostco membershipSalary sacrifice, company car schemeCycle to Work SchemeEmployee Assistance ProgrammeFree breakfast, fruit, and hot/cold beveragesReferral schemeEmployee discountPrivate medical insurance (taxable benefit) or healthcare cash plan (costs incurred by employees) Essential Skills Skills/Experience Required  10 years in graphic design roles, including demonstrable print and digital experience.Experience managing a small Graphic Design team.Experience using project management tools, such as Trello.Previous experience using CMS, design/editor tools (ideally Adobe Creative Suite) or back-office solutions. Desirable Skills  Previous in-house or client-side experience would be advantageous.Experience using Foleon or similar digital publishing platforms would be advantageous.Video creation/editing skillset is desirable. Apply for this Senior Graphic Designer role today and we'll be in touch with the next steps. About Company Here at Travel Counsellors, our customers, communities and colleagues lie at the heart of everything that we do - and that's what makes us special. For us, relationships come before transactions, and we are there for our customers, connecting with them on  a deeply human level through the moments that matter. We've been changing lives for the past 30 years as the leading travel marketplace for self-employed travel entrepreneurs, empowering over 2,000 global independent travel agents to run successful leisure and corporate travel businesses. We pride ourselves  on remaining a company that truly cares and has never wavered from its purpose; to redefine what personal means for a travel business. Our Travel Counsellors are supported by a team of over 300 super-talented people in our support offices to help them create unique, inspiring and exciting experiences for their customers whilst building lasting personal relationships that bring them back  to us, time and time again. Our unique approach within the workplace - as well as towards customers - has seen us receive numerous awards and accolades, including being named The Best Place to Work in Travel at the 2022 TTG Travel Industry Awards, placing in the Sunday Times Best Places  to Work list 2023 (Large Company) as well as being the first travel company to be awarded the Queen's Award for Enterprise in the Innovation category! We are expanding at a phenomenal rate - on the back of what is our record year in terms of revenue (over 930m) - and are looking for outstanding individuals to join our dedicated Head Office team to help the company continue to flourish. ",Urmston,False,True
