Job Title,Job Description,Location,Part-time,Full-time
Preparation Technician," Preparation Technician - bravoauto TowcesterSalary 36,026.30, OTE potential of 39,628.93Full Time, 45 Hours. Monday to Friday only. Work on great cars, with great people. Enjoy support that’s second to none as a Prep Technician at bravoauto, part of Inchcape UK. When you join our fun, friendly team, you’ll be working with some of the world’s best-known car brands. And as new types of vehicles become more mainstream in our changing industry, you’ll have the opportunity to grow your skills and broaden your experience. What we can offer you  33 days’ annual leave, including bank holidays (pro rata), rising with length of service. Holiday buying scheme also availableRetail discounts that save you money every dayGym discounts, cash healthcare plans, and a cycle-to-work schemeCar discounts for new and used purchases and servicingFlexible pension scheme and Sharesave scheme to grow your savingsFamily-friendly policies that help you spend more time with the people that matterA wellbeing programme to support you and your familyAn internal colleague recognition system to celebrate achievementsA community volunteering day New bravoauto Technicians are eligible for welcome and loyalty bonuses totalling 2,500* What you’ll do day to day  Conduct vehicle preparation, servicing, maintenance, and repair on a variety of makes and modelsUtilising your technical knowledge to inspect the engine and mechanical/electrical components to diagnose issues accurately, using computer-based diagnostic equipmentCarrying out DVSA vehicle testing (if authorised)Repairing and replacing broken or defective parts to resolve vehicle defectsRoad testing vehicles to check for faults and repairsSupporting other Technicians in the WorkshopFollowing checklists to ensure all procedures are completed and completing all documentation to the required standard Helpful skills and qualifications Don’t worry about ticking off every single skill here - if you care about delivering great experiences as much as we do, we want to hear from you.  A NVQ level 2 or 3 in Light Vehicle Maintenance  Repair or equivalentA full UK driving licenseA current valid MOT License is an advantageous but not essentialThe capability of working to deadlines whilst maintaining the highest quality standardsGreat team player and communication skills Who we are Inchcape is a global automotive group that sells, services, and repairs the world’s best-known car brands, from Audi, Toyota, Volkswagen, and Lexus to BMW, Jaguar, Land Rover, and Mercedes-Benz. At bravoauto, our own used car brand, we buy, sell, and finance  the best used cars in the UK. Our mission is to create outstanding and trusted experiences for our customers, our partners, and our people. That’s why we believe that Inchcape is for everyone - including you. *Terms  Conditions; 1,000 sign-on bonus payable in month after probation ends. 500 additional bonus payable after 6-months and a further 1,000 loyalty bonus payable at 12-month anniversary. Further TCs apply. ",Towcester,False,True
Football Coach,"Working With UsWe are an‘Outstanding’(Ofsted 2023) secondary academy, established in 2018 to provide an excellent education for children in Wimbledon. With our new Sixth Form that opened last year, we will soon have a full cohort of students aged 11-18. Two years after opening, we moved into our brand-new building which is modern, bright and equipped with state-of-the-art facilities in every area of the curriculum. We are oversubscribed and fortunate to have an amazing level of support from the community  with waiting lists for entry into every year group of our academy. Harris Academy Wimbledon promotes high levels of academic achievement across the curriculum, encourages participation in extra-curricular opportunities and empowers students to make decisions wisely. The curriculum is rich, diverse and personalised ensuring  every student achieves his or her true potential. Academic success goes hand-in-hand with a rich variety of enrichment and extra-curricular activities; these activities help foster a spirit of aspiration, resilience and joy in learning. Professional learning is at the heart of academy supporting all staff in their development. The academy has a growth mindset approach where industry and commitment are seen as cultural virtues. Development of resilience, self-esteem, managing risks/consequences  and the ability to work effectively together all form a key part of the pastoral provision. There is a great deal of collaborative working and sharing of good ideas about what works within secondary academies at Harris. The successful candidate will be joining a friendly and outward looking group where professional development and progression opportunities  are second to none. Main Areas of ResponsibilityYour responsibilities will include:  Leading football at break and lunchtimes on the MUGASupporting the PE department extracurricular programmeBeing a manager for at least two football teamsLeading Fun Football every Friday What We are Looking ForWe would like to hear from you if you have:  A football qualification to at least Level 2Must have a driving licence, including the ability to drive a school mini-bus Prior experience successfully coaching mixed ability children aged 11  For the full job description and person specification, please download the Job Pack. Applying for this PositionOur people are at the heart of our success. We have developed a strong culture of collaboration and best practice, with professional development and career planning at its centre. We invest in our staff with support, coaching, mentoring, and a wide range  of top-quality training programmes delivered at every level. In addition to the opportunities for career development and progression, we also offer a competitive rewards and benefits package which includes a Performance and Loyalty Bonus, Pension Scheme with generous employer contributions, a Wellbeing Cash Plan, electric  car scheme, 26 days' annual leave (plus bank holidays) for staff who work across the full year, and many other benefits. Learn more about our benefits on our website. ",London,True,False
Electrical Assessor," Electrical Assessor Electrical Installations Accreditation Body Derby, Matlock, Buxton, Ilkeston, Chesterfield, Ashbourne Circa 52,000 per annum Basic Salary  Company Car or Car Allowance  Home Office Allowance  10% Pension  Health Insurance  This is an excellent opportunity for someone with a high level of knowledge and understanding of domestic, commercial, and industrial electrical installations.A strong Electrical Supervisor, Electrical Manager, or Qualifying Supervisor with a knowledge of BS 7671 and related codes of practiceFantastic opportunity to work with a wide and varied customer base for a renowned market leader The Company recruiting for the Electrical Assessor:  The company is a 'not for profit' organisation and pride themselves on being a fair employer to work for.They have been in business for over 60 years and are extremely proud to be a Best Company to Work For. This demonstrates how important their people are and recognises everything they do to make sure their people have a working experience that's the best  it can be.The company's mission is to make a positive difference to their customers and their people, and to provide a service that's second to none. The Role of the Electrical Assessor:  You will be responsible for certifying and assessing electrical installations and contractors in your local area.You will ensure that contractors and installers are complying to the relevant codes of practice for installations; specifically, BS 7671 and the 18th Should work fall short of these standards, you will implement improvements and corrections to ensure that  current and future work meets these standards.50% of the role will be dealing with sole traders, and 50% will be dealing with larger national and regional contractors.Building lasting relationshipsMon - Fri role, 35 hours per week The Candidate for the Electrical Assessor:  You'll need to have an excellent understanding of electrical installations and related codes of practice, specifically BS 7671 and a current 18th edition qualification.Additionally, holding a further electrical qualification at NVQ level 4 or equivalent would be of significant interest too.You'll hold an 18th Edition qualification as well as CG 2391 OR CG 2394  CG 2395Be qualified to NVQ Level 3 or above (or equivalent) in an electrical disciplineHolding a CG 2396, CG 'C' level electrical certificate, CG 2400, Electrical ONC, or Electrical HNC will be extremely advantageousIdeally, you will have been a Qualified Electrical Supervisor, or have an Electrical teaching backgroundYou'll need excellent communication skills, with the ability to build relationships with contractors and independent tradersA full UK driving licence is essential The Package for the Electrical Assessor:  Circa 52,000 per annum basic salary10% Company pension35 hours per weekCompany car or car allowanceHome office allowancePrivate health schemeLife assuranceProfessional membership feesUp to 3 days of flexible leaveUp to 5 days of special leave for emergencies25 days holiday plus statutory Bank/Public holidays (Rising by 1 per year to maximum of 30)3 additional days for Christmas/New Years shutdown period Please apply for this job online if you are interested meet the above criteria. INDENG ",Derby,False,True
Electrical Manager," Electrical Manager Electrical Installations Accreditation Body Derby, Matlock, Buxton, Ilkeston, Chesterfield, Ashbourne Circa 52,000 per annum Basic Salary  Company Car or Car Allowance  Home Office Allowance  10% Pension  Health Insurance  This is an excellent opportunity for someone with a high level of knowledge and understanding of domestic, commercial, and industrial electrical installationsA strong Electrical Supervisor, Electrical Manager, or Qualifying Supervisor with a knowledge of BS 7671 and related codes of practiceFantastic opportunity to work with a wide and varied customer base for a renowned market leader The Company recruiting for the Electrical Manager:  The company is a 'not for profit' organisation and pride themselves on being a fair employer to work for.They have been in business for over 60 years and are extremely proud to be a Best Company to Work For. This demonstrates how important their people are and recognises everything they do to make sure their people have a working experience that's the best  it can be.The company's mission is to make a positive difference to their customers and their people, and to provide a service that's second to none. The Role of the Electrical Manager:  You will be responsible for certifying and assessing electrical installations and contractors in your local area.You will ensure that contractors and installers are complying to the relevant codes of practice for installations; specifically, BS 7671 and the 18th Should work fall short of these standards, you will implement improvements and corrections to ensure that  current and future work meets these standards.50% of the role will be dealing with sole traders, and 50% will be dealing with larger national and regional contractors.Building lasting relationshipsMon - Fri role, 35 hours per week The Candidate for the Electrical Manager:  You'll need to have an excellent understanding of electrical installations and related codes of practice, specifically BS 7671 and a current 18th edition qualification.Additionally, holding a further electrical qualification at NVQ level 4 or equivalent would be of significant interest too.You'll hold an 18th Edition qualification as well as CG 2391 OR CG 2394  CG 2395Be qualified to NVQ Level 3 or above (or equivalent) in an electrical disciplineHolding a CG 2396, CG 'C' level electrical certificate, CG 2400, Electrical ONC, or Electrical HNC will be extremely advantageousIdeally, you will have been a Qualified Electrical Supervisor, or have an Electrical teaching backgroundYou'll need excellent communication skills, with the ability to build relationships with contractors and independent tradersA full UK driving licence is essential The Package for the Electrical Manager:  Circa 52,000 per annum basic salary10% Company pension35 hours per weekCompany car or car allowanceHome office allowancePrivate health schemeLife assuranceProfessional membership feesUp to 3 days of flexible leaveUp to 5 days of special leave for emergencies25 days holiday plus statutory Bank/Public holidays (Rising by 1 per year to maximum of 30)3 additional days for Christmas/New Years shutdown period Please apply for this job online if you are interested meet the above criteria. INDENG ",Derby,False,True
Business Development Executive," The Pilot Group (ESL - Business Development Executive) Our businesses cover electrical wholesale, energy management, EV charging and traffic control systems, working across a wide range of commercial and industrial applications - This role sits specifically in ESL who are one of the businesses that make up the  group- they are in essence a global trading business. ESL connects the demand and supply of industrial electrical components. As the world shifts to a more electric future, ESL helps customers procure their needs in this space by thinking and operating differently. The company joins supply chains together in a simple and easy-to-deliver way. ESL sources requirements internationally to develop long-term relationships with customers and suppliers, we hold stock in three warehouses (UK, Europe, and America), we provide  next-day delivery, and we provide local service in many countries by communicating in more than 18 different languages. ESL is headquartered in Manchester with people located around the world. It was founded by two female entrepreneurs 17 years ago (both are still in the business) and the company has continued to deliver double-digit growth year after year. The company has  75 amazing people with brilliant skills. We are now on a journey to build on this fabulous platform to create an even more connected and more automated environment that delivers outstanding service to our chosen markets. What will you be doing as a Business Development Executive? You’ll be researching and identifying new customers via internet research, business to business calls and other media. You will then organise your own call plan to ensure that you achieve your targets and develop good habits. You'll be responsible for generating  new business in the US market and selling our electrical products by making follow up calls and speaking to potential new customers. To be successful you will spend time researching your market and monitoring any trends and opportunities. You will receive  full training and work closely with a Regional Sales Manager to set your own achievable KPIs and business plan. Our training plan is second to none, we will share experience from people who have been in the business for years and our Regional Sales Manager will be your mentor and will guide you through the full sales process. You will learn by doing so you don't need  any previous sales experience, just the resilience and drive to accept a challenging role and win new customers! You will be target driven and you will be motivated by getting a yes or a sale from a potential customer. Your ultimate goal will be to build enough  new customer relationships to sustain your commission and revenue targets, which we expect will take up to 12 months. Business Development Executive Essential Skills:  Excellent Communication SkillsResilientCold Calling - Client ProspectingGood rapport buildingConfident at speaking to new potential customers on the telephoneHappy to work on your own or as part of a small team.Responsible, conscientious, and self-motivatedExcellent written and spoken communication skillsAbility to analyse informationAttention to DetailFast learner to pick up a bespoke system Business Development Executive Benefits:  Monthly Peer recognition awardsHolidays increase with length of serviceOpportunity to buy additional holidaysLife AssuranceHealthshield - health cash plan that allows you to claim healthcare costsSalary Sacrifice Savings SchemeRegular charity eventsInformal, supportive and friendly team Working hours 9:30am - 6:30pm Monday - Friday Location: Head Office, Manchester (Short walk from Manchester Victoria train station) Commutable from: Manchester, Greater Manchester, Oldham, Rochdale, Warrington, Widnes, Runcorn, Preston, St Helens, Altrincham, Stockport, Bury, Bolton, Leigh, Wigan, Wilmslow Recruitment Agencies; The Pilot Group operates a strict PSL and will not accept any unsolicited CVs sent to any member, employee, representative or business unit of the Pilot Group. Any unsolicited introduction will be treated as a CV 'sent in kind’ and as such The Pilot Group  rejects all liability to pay any such fees for an unsolicited introduction. ",Manchester,False,True
Supply Planner," About the role Booker Group the UK\'s leading wholesaler is recruiting for aSupply Planner withinour Supply Chain butcheryteam. The role will be based out of our head office in Wellingborough, supporting our branches and Category teams. Within this role you will be a pivotal part of the Supply Chain team by improving cash profit and customer satisfaction throughout the efficient management of stock. Our Supply Chain teams are driven to succeed and process orientated, tasked with ensuring stock is in the right place at the right time. Whilst this can be a challenging role, the sense of accomplishment you will feel after finding resolutions or solving  problems is second to none. Role Responsibility  Optimising stock levels and maintaining stock availabilityProactively reviewing stock levels and escalating as requiredAccurate forecasting to ensure stock levels are correct and allocated appropriately across all of our branchesEnsuring the release and flow of stock is within agreed timescalesBuilding strong working relationships with internal and external teams including third party suppliersWorking in partnership with operations and distribution centres to efficiently manage storage space . You will need  Excellent communication skills with the ability to negotiate and influence at all levelsA high level of organisational and time management skillsThe ability to prioritise and keep to tight deadlinesExperience of using a PC with a thorough working knowledge of ExcelAnalytical skills with good attention to detailTo be reliable, calm, focused and tenaciousKnowledge of the FMCG sector, ideally food. Whats in it for you At Booker, along with being a great place to work and giving you an opportunity to get on in your career, we also offer the following fantastic package of benefits:  A Booker colleague card with 10% off purchases at Booker and double discount events up to three times a year.After 3 months service, a Tesco colleague discount card with 10% increasing to 15% off most purchases at Tesco for a 4 day period after every four-weekly pay day, ie. thirteen times a year. In addition to 10% off at Tesco Cafe and 20% off all FF purchases.10% off pay monthly  SIM only deals with Tesco Mobile for yourself, along with further great deals through-out the year.Up to 30% off car, pet and home insurance at Tesco bank. Terms and conditions apply.Free eye test when you spend 50 or more. You can also save 30% when you spend 50 or more on glasses, prescription sunglasses and contact lenses.50% off health checks at Tesco Pharmacy.Exclusive access to discounted RAC breakdown cover ratesAn exclusive deals and discounts website saving you money on everyday purchases including a cycle to work scheme.After 3 months service, you can join our annual Save As You Earn share scheme which allows you to buy Tesco shares in the future at a discount.Retirement savings plan (pension) - save up to 5% and Booker will match your contribution.Life Assurance - You are covered for death in service life cover of up to three times annual payHealth and Wellbeing support and resources including our 24/7, confidential Employee Assistance Programme for you and your family.A great holiday package About The Company Be part of something special. Join our team at Booker. Booker is the UK’s leading food  drink wholesaler. We are privileged to serve independent retailers, caterers and small businesses, from locations across the country. Booker Group comprises of Booker Wholesale, Makro, Booker Direct, Classic Drinks, Ritter Courivaud and Chef Direct. Our customers include Premier, Family Shopper, Budgens and Londis retailers and we have one shared aim - improving choice, price and service  for all our customers. Our business is incredibly diverse, so it takes a wide range of skills to deliver the exceptional service our customers require. Wherever you join us, you’ll be part of an organisation that will help your career to keep moving forward. *Booker Group is part of Tesco plc, however is operated separately from the core Tesco business and as such the benefits offered will be different from those offered at Tesco* ",Wellingborough,False,True
