Job Title,Job Description,Location,Part-time,Full-time,Graduate,Minimum Salary
Data Science Developer - London,"Data Science Developer - Permanent - CFA Level 1 London90,000 - 120,000 per annumAs a Data Science Developer specialising in Machine Learning  Deep Learning, you will play a crucial role in our dynamic Portfolio Performance Analytics team. In this position, you will be at the forefront of leveraging advanced quantitative techniques to  enhance decision-making processes for Private Credit, Liquid Credit, and Private Equity Fund of Funds products Investment Products.Key Responsibilities1 Model Development and Enhancement:* Utilise your expertise in machine learning and deep learning to develop and refine quantitative models, such as credit risk models and alpha models, for risk assessment, portfolio optimisation, and alpha generation.* Collaborate with cross-functional teams to integrate advanced quantitative techniques into the investment process and corporate fund finance operations.* Data Analysis and Integration:* Conduct thorough business analysis to identify potential risks and opportunities associated with investment decisions.* Collaborate with business stakeholders to understand their goals and provide quantitative insights that align with overall business strategies.* Work with large datasets, utilising statistical methods and machine learning algorithms to extract meaningful insights that inform investment decisions.* Risk Management:* Contribute to a well-rounded approach to managing risks across our diverse alternative investment products, corporate fund finance, and treasury management.* Monitor and assess the risk exposures of the portfolios, identifying potential areas for improvement and mitigation.* Quantitative Research:* Stay abreast of industry trends and advancements in quantitative finance, machine learning, and deep learning, and apply this knowledge to enhance the firm's quantitative capabilities.* Conduct thorough research on market trends, investment strategies, and relevant financial instruments.* Model Delivery Cycle:* Manage and enhance the model delivery cycle, ensuring timely and effective deployment of quantitative models into the investment process.* Work closely with the technology teams to integrate innovative models into the investment decision-making framework.* Performance Monitoring:* Implement robust performance monitoring processes to track and evaluate the effectiveness of quantitative models and investment strategies.* Provide regular reports and analysis on the performance of portfolios, identifying areas for improvement and optimisation.* Collaboration and Communication:* Collaborate with portfolio managers, corporate finance managers, business development managers, and other stakeholders to understand their needs and provide quantitative solutions.* Clearly communicate complex quantitative concepts and findings to non-technical stakeholders, fostering a collaborative and informed decision-making environment.Required Qualification/Skills1. Educational Background:* Master's in a quantitative discipline such as Computer Science, Finance, Economics, Statistics, or a related field (preferred).2. Professional Experience:* Minimum of 3-5 years of experience in quantitative analysis, financial modelling, and software development.* Demonstrated experience in developing quantitative models for portfolio optimisation, risk management, and performance attribution.3. Financial Expertise:* Passed CFA Level - 1.* Strong understanding of financial markets, investment products, and risk management concepts.* Experience in working with financial data, analysing balance sheets, cash flows, and financial statements.",London,False,True,,90000.0
CTO - AI Focused in EdTech," Chief Technology Officer (CTO) - AI Focused in EdTech (Remote/London) Are you a visionary leader with a passion for revolutionizing education through cutting-edge AI technology? My client is a leading EdTech company, seeking a dynamic and experienced Chief Technology Officer (CTO) to lead their AI-focused initiatives. Join  them in their mission to transform the future of education and make a lasting impact on learners globally. They are seeking a strategic and commercially minded CTO. Chief Technology Officer (CTO) - AI Focused in EdTech (Remote/London) My client is Empowering Education Through Innovation Are you a visionary leader with a passion for revolutionizing education through cutting-edge AI technology? My client is a leading EdTech company, seeking a dynamic and experienced Chief Technology Officer (CTO) to lead their AI-focused initiatives. Join them  in their mission to transform the future of education and make a lasting impact on learners globally. They are seeking a strategic and commercially minded CTO. Responsibilities: AI Strategy and Innovation:* Develop and execute a comprehensive AI strategy aligned with the company's mission and goals.* Lead the exploration and implementation of innovative AI technologies to enhance learning experiences. Technology Leadership:* Provide strategic direction for the technology team, ensuring alignment with business objectives.* Foster a culture of innovation, collaboration, and continuous improvement within the technology department. Product Development:* Oversee the development of AI-powered educational products and solutions, ensuring high-quality and user-centric design.* Collaborate with cross-functional teams to bring new AI features and capabilities to existing and future products. AI Research and Development:* Stay abreast of industry trends, emerging technologies, and advancements in AI to drive research and development initiatives.* Build and maintain partnerships with academic institutions and research organizations to stay at the forefront of AI in education. Technical Leadership:* Provide technical leadership and guidance to the development team, fostering a culture of excellence and accountability.* Ensure the scalability, security, and reliability of our AI infrastructure. Qualifications:* Proven experience in a leadership role focused on AI and technology in an EdTech or related industry.* Strong background in AI and machine learning, with a track record of successful implementation in educational products.* Demonstrated ability to formulate and execute strategic technology initiatives.* Exceptional leadership and communication skills, with a collaborative and inclusive approach.* Experience working in agile development environments and driving product development from concept to launch. Education:* Master's or Ph.D. in Computer Science, Artificial Intelligence, or a related field is preferred. Benefits:* Competitive salary around 150,000* Flexible work hours and remote work options. * A dynamic and inclusive work culture committed to making a positive impact on education.If you are a forward-thinking technology leader excited about the intersection of AI and education, I invite you to join my client on their journey to reshape the future of learning. Apply now by submitting your resume, to  My client is an equal opportunity employer. They celebrate diversity and are committed to creating an inclusive environment for all employees. Robert Walters Operations Limited is an employment business and employment agency and welcomes applications from all candidates ",London,False,True,,150000.0
Data Analyst / Data Scientist," Data Analyst / Data Scientist As a Data Analyst / Data Scientist for this innovative and transformation focused consultancy, you will become part of a very experienced and diverse team who focus on adapting to their client’s needs. With wide ranging transformation projects across Central  Government, Defence, Intelligence/Security and Emergency Services, this role offers an extensive list of programmes to get your teeth into - if you like to see your work have an impact, this is the place for you. Creating genuinely useful Data outcomes and  hands on analytics are the key aspects of this role - you’ll be required to hit the ground running with gravatas and advisory capabilities.  Experience  3-5 years Data Analyst / Data Scientist expertiseDemonstrable background on Public Sector programmes, strong stakeholder management skills and communicationPython and/or R expertise, Numerical analysisTechnology procurement experience and know-howKnowledge with Power BI, Qlik Sense and Big Data toolsBusiness transformation and change programme involvement A varied background, diverse programme exposure and a STEM degree would be preferrable, however, an ability to demonstrate your capability to adapt and change to requirements is most important. Candidates must be eligible and willing to gain UK Security  Clearance to apply for this position. ",London,False,True,,70000.0
Angular Developer AI Software," Angular Developer (AI Software) 70,000 - 80,000  Progression  Fully WFH Remote / London Are you an Angular Developer looking to join a thriving pioneer of artificial intelligence video analytics (A.I.V.A.) that are working on the latest advancements of AI Software and are at the forefront of innovation in the UK?  Do you want the opportunity to work on software used by government bodies, manufacturing companies and casinos to regulate CCTV footage with a hybrid engine for AI patented by this up-and-coming computer vision department? On offer is a once in a lifetime opportunity to join a growing team of highly skilled developers with a common goal, working on projects that span across the globe and have influence on our society as it develops into the next generation of technology. In the role, the Angular Developer will be working on the frontend on A.I.V.A. software for projects that enable the success of traffic, airports and business. Having full autonomy on your code you will check in occasionally with the wider team to communicate  developments and fixes being made. This role would suit a technically proficient developer with expertise in Angular looking for a career in a meaningful organisation. THE ROLE:  Working on highly technical productsFixes bugs and troubleshooting issuesDeveloping software with Angular on the frontend THE PERSON:  Experienced Angular DeveloperProficient in text-direction aware CSS styles (margin/padding/...)Proficiency in CSS grid layout Keywords: Angular, Software Developer, Full Stack Developer, Frontend Developer, Backend Developer, Developer, AI Development. Reference Number: BBBH11988 If you're interested in this role, click 'apply now' to forward an up-to-date copy of your CV. We are an equal opportunities employer and welcome applications from all suitable candidates. The salary advertised is a guideline for this position. The offered renumeration will be dependent on the extent of your experience, qualifications, and skill set. Ernest Gordon Recruitment Limited acts as an employment agency for permanent recruitment and employment business for the supply of temporary workers. By applying for this job, you accept the TC's, Privacy Policy and Disclaimers which can be found at our  website. ",London,False,True,,70000.0
Marketing Manager AI Technology," Marketing Manager (AI Technology) Woolwich, London-Hybrid 60,000 - 70,000  Work From Home  Progression  33 Days Holiday  Pension Do you want the opportunity to work in an ambitious company, who are currently investing heavily to push their own AI technology, who are poised to launch several exciting new technologies to automotive OEMs, channel partners and the fleet/commercial vehicle  market? Are you looking for a role where the more skill and interest you show, the more you can really drive the role in the direction you choose, and bring as much marketing in-house as possible? This role is really made for someone with a passion for all things  marketing and wants the backing to work freely and make use of all the latest technology. On offer is the chance for a Marketing Manager to join an industry leading company that provide cutting edge vehicle safety AI, whose technology is trusted by Transport for London and other industry leading automotive companies. In this role, the successful Marketing Manager will be managing and executing all online and offline marketing campaigns on time and on budget, as well as managing and producing written content and working with graphics. This role would suit an experienced Marketing Manager with hands-on experience in executing digital marketing campaigns, happy to take the role on an initial 12 month contract. The Role  Implementing SEO best practicesKeeping the website and social media channels fully updatedPresenting advanced data analyticsAssisting in the organisation of outbound Exhibitions and Events The Person  Experience of managing and coordinating marketing projectsExperience in working with Pardot and Salesforce SoftwareProficient in Gimp, Canva or similar and good editing skills Key words: Marketing, Manager, Marketing Manager, Campaigns, SEO, Social Media, Content, Hybrid, Remote, Reference Number: BBBH12454 If you're interested in this role, click 'apply now' to forward an up-to-date copy of your CV. We are an equal opportunities employer and welcome applications from all suitable candidates. The salary advertised is a guideline for this position. The offered renumeration will be dependent on the extent of your experience, qualifications, and skill set. Ernest Gordon Recruitment Limited acts as an employment agency for permanent recruitment and employment business for the supply of temporary workers. By applying for this job, you accept the TC's, Privacy Policy and Disclaimers which can be found at our  website. ",London,False,True,,60000.0
AI Product & Innovation Manager," AI Product  Innovation ManagerLondon70,000 - 75,000  Bonus  benefits The CompanyThis leading international Legal Professional Services group operating in Europe, Asia and the Middle East, boasts a strong track record of delivering high quality services to a blue-chip portfolio of clients in some of the fastest growing markets in the world.  Ongoing expansion has created a new opportunity for an experienced Product Owner or Legal Technology expert, ideally within AI tools to join an Innovation team. This is a creative and innovative role to drive innovation firmwide alongside managing a new GenAI  tool, you will upskill and empower colleagues to utilise new products. Key Responsibilities of the AI Product  Innovation Manager  Working alongside an external consultant regarding on-going training of a new AI toolWorking with high-value clients to gather feedback and improve the productLiaising with web designers to make changes to productDesigning a process whereby new knowledge/know how is input into the productWriting and supporting business cases for new features of productWorking with broader business to drive AI product usage to the firmLiaising with the IT team where new processes require technology implementationCreating a roadmap for the business to instil a culture of innovation Skills  Attributes of the AI Product  Innovation Manager  Demonstrable previous experience within technologies, innovation consultancy, change, process improvement or business analysisAn interest in innovation and technology and be open to new ideasAble to understand high performance business environments and deal competently and diplomatically with lawyers and business services professionals of all levelsExcellent communication skills with a professional approach to clients and the ability to collaborate effectivelyAbility to facilitate and lead workshops and meetings with clients, internal teams and senior stakeholdersKnowledge of technology and IT literate including MS Office and excellent written and oral communication skillsExperience working with a range of legal tech tools is highly desirable, especially any experience of GenAI products Applications can only be considered from those eligible to live  work in the UK without restriction.  Harcourt Matthews is acting as an Employment Agency in relation to this vacancy. Our divisions include: Legal Operations (Legal Tech and Legal Project Management, LPM, Operations Project Managers, Change, Innovation and Process Improvement); Accounting   Finance (Part and fully qualified Accountants); Pricing  Strategy; Pfi/PPP  FM. Harcourt Matthews is committed to diversity and inclusion. We value and encourage applications from all ethnicities and welcome everyone regardless of social background, disability, gender identity, and orientation. Diversity benefits us all and challenges  our assumptions. Keywords: AI, product owner, product manager, legal tech, legal technology, innovation, knowledge, legal, law  Ref: BHJOB3543_5697 ",London,False,True,,70000.0
Data Science Engineer - DV Cleared," DATA SCIENCE ENGINEER - DV CLEARED NEW PERMANENT OPPORTUNITY AVAILABLE FOR A DATA SCIENCE ENGINEER IN LONDON WITH DV CLEARANCE   Permanent opportunity for a Data Science EngineerDV security clearance is requiredSalary up to 85,000 plus bonus and benefitsLondon based organisation in an accessible locationTo apply please call / or email  WHO WE ARE? We are recruiting a permanent Data Science Engineer to work with a leading technology and engineering company that do excellent work in the National Security sector across a range of exciting projects. Due to the nature of our clients, you must hold DV security  clearance. WHAT WILL THE DATA SCIENCE ENGINEER BE DOING? As a Data Science Engineer, you will be working alongside our team on a wide variety of projects with a special focus on innovation and AI. You could be working with all types of data (both structured and unstructured) using a variety of software - so we're  open to seeing engineers with different technology backgrounds! THE DATA SCIENCE ENGINEER SHOULD HAVE….  Strong and demonstratable technical background in data scienceDemonstratable experience developing  delivering data science strategiesExperience with big data ecosystems, cloud infrastructure and analytic frameworksTechniques and toolkits for data cleansing, data processing and data preparationAny experience with techniques and toolkits for combining data or analysing data streams would be desirableCurrent DV security clearance TO BE CONSIDERED…. Please either apply by clicking online or emailing me directly to For further information please call me on or - I can make myself available outside of normal working hours to suit from 7am until 10pm. If unavailable, please leave a message and either myself  or one of my colleagues will respond. By applying for this role, you give express consent for us to process  submit (subject to required skills) your application to our client in conjunction with this vacancy only. Also feel free to follow me on Twitter @ContractsDom  or connect with me on LinkedIn, just search Dominic Barbet. I look forward to hearing from you.  DATA SCIENCE ENGINEER KEY SKILLS: PRINCIPAL DATA SCIENTIST / LEAD DATA SCIENTIST / MACHINE LEARNING / ML / NLP / NATURAL LANGUAGE PROCESSING / DEEP LEARNING / DATA SCIENCE / LSTM / LONG SHORT TERM MEMORY / CNN / COGNETIVE NEURAL NETWORKS / CLOUD INFRASTRUCTURE / ARTIFICIAL INTELLIGENCE  / INNOVATION / SECURITY CLEARANCE / DV CLEARED / SC CLEARED / SC CLEARANCE / SECURITY CLEARANCE / DV CLEARANCE / DEVELOPPED VETTING / DEEP VETTING / DEVELOPPED VETTED  ",London,False,True,,40000.0
Project Manager - Central Gov," Project Manager - Central Gov - 450 - 500 a day - Outside IR35 - 6 Months We are looking for an experienced Project Manager to support a Central Goverment client with the following projects. 1.Microsoft Information Protection (MIP)– Secure email and file sharing. Implement and rollout Microsoft Purview Information Protection to enable The client to align more closely to the new Government Security Classifications Policy (GSCP). This initiative proposes to replace the current Egress Email encryption tool with Microsoft’s M365 native tooling and evaluate a replacement for the Egress large file transfer tool. Align with the recently updated GovernmentSecurity Standards and Classifications by implementing the Digital Rights Management (DRM) and Data Loss Prevention (DLP) modules. 2. AI workstream Support market analysis and assessment of a range of AI tools and opportunities Working with case teams to map use cases for AI to improve efficiency and effectiveness Business case development Supporting activities to prepare for and implement Microsoft AI tools e.g. Co-Pilot InterQuest Group is acting as an employment agency for this vacancy. InterQuest Group is an equal opportunities employer and we welcome applications from all suitably qualified persons regardless of age, disability, gender, religion/belief, race, marriage,  civil partnership, pregnancy, maternity, sex or sexual orientation. Please make us aware if you require any reasonable adjustments throughout the recruitment process. ",London,False,True,,450.0
Data Science Manager - Hyper Personsalisation," Data Science Manager - Hyper Personalisation Grocery Retailer Manage a team of 6 Data Scientists Own a 100 million budget Strong culture of promotion, training and development Working with one of the biggest data sets in the country ?? 80k plus 20% bonus ? ONLY 1 day in office Central London required Join one of most established, mature and advanced analytics functions in the UK market. As one of the first major players to embrace and successfully roll out a loyalty card scheme, their heritage in data-driven decision making makes for an amazing learning environment. Working amongst a vast data community, and a specialized analytics function dedicated to marketing, you will lead a team of 6 Data Scientists responsible for developing algorithms and analytics which are the foundations for highly personalised offer, discounts  and promotions for a third of the UK's population. You will also need to be hands on yourself, demonstrating a strong technical competency with various customer and marketing related data scienced techniques such as forecasting, building next best message engines, personlisation etc. You will inspire, coach  and lead your team as well as build meaningful stakeholder relationships as well as identifying opportunities for new commercial wins. You'll work hand in hand with Product Managers and Engineers to build out the omnichannel decisioning platform and capabilities, developing algorithms which inform offers for individual customers, as well as solving complex optimisation problems and supporting  loyalty and CRM initiatives. You will have ownership of a 100 million budget, so previously budget management experience is key. Experience required: ·Educated to at least degree level in a numerate subject such as engineering, mathematics, statistics, chemistry, physics, machine learning, computer science etc. ·Extensive programming skills using tools such as Python, R, Spark, Hadoop, SQL and cloud based platforms such as GCP, Azure and AWS to model, manipulate and analyse various customer data sets in large volumes ·High level understanding of data architecture/governance ·Strong analytical skills and statistical understanding including modelling, probability, recommendation, optimisation problems and other quantitative modelling techniques ·Background in data science from ideally a retail, consulting or blue chip background ·Experience in the application of data science within marketing and a wider business context ·Confident and strong presentation skills; ability to bring data to life for senior leaders and non-technical stakeholders ·Experience in either mentoring or managing teams of people ·Thrives in a pacey, entrepreneurial and high performing environment ·Strong team collaboration skills, able to work in a dynamic and solutions focused environment ",West London,False,True,,75000.0
Fullstack Developer," Job Title: Mid-level Fullstack Developer Location: London (3-4 days a week on-site) We're seeking a Fullstack Developer for one of our clients based in Chelsea, they're a dynamic AI start-up in the Saas industry looking for an experienced individual who can help them build their product from the ground up. As a Fullstack Developer, you'll be the go to person, using your expertise in React, NextJS, Typescript  Python. Experience in AI is a massive bonus but not necessary. Due to the nature of their business, they cant offer sponsorship or take on dependant visas ",London,False,True,,50000.0
Senior Fullstack Developer," Job Title: Senior Fullstack Developer Location: London (3-4 days a week on-site) We're seeking a Senior Fullstack Developer for one of our clients based in Chelsea, they're a dynamic AI start-up in the Saas industry looking for an experienced individual who can help them build their product from the ground up. As a Fullstack Developer, you'll be the go to person, using your expertise in React, NextJS, Typescript  Python. Experience in AI is a massive bonus. Due to the nature of their business, they cant offer sponsorship or take on dependant visas ",London,False,True,,80000.0
