Job Title,Job Description,Location,Part-time,Full-time
Family Solicitor,"FAMILY SOLICITORCENTRAL BIRMINGHAM30K - 40KA well regarded fast growing national Law firm have an urgent requirement for an NQ - 3 years PQE Family Law Solicitor to manage a caseload of Legal Aid family matters. Salary is up to 40K dependant on experience.One of Birmingham's fastest growing law firms are seeking a NQ - 3 years PQE Family Solicitor to join their expanding Family department.A Family Solicitor is wanted to deal with a caseload of None Molestation orders and Injuctions, the successful applicant will ideally have some exposure dealing with Domestic Violence matters but good legal aid and advocacy experience is essential.This is an excellent opportunity for a Family Solicitor that is looking to join a firm which will support panel membership and offers excellent career development opportunities. The firm will allow some home working. Don't miss out send me your CV today for  immediate consideration!!!",Birmingham,True,False
Family Paralegal," First class opportunity for a family paralegal to join the this highly regarded York practice who have a strong presence across Yorkshire and further afield. The quality of work is second to none and you will support the team of a range of family matters including relationship breakdowns, cohabitation agreements and mediation.  Previous experience as a family paralegal is essential as are strong communication skills and a genuine desire to specialise in family law. Offering a very inclusive culture with agile working and clear career development opportunities this is a stand out role in a very impressive business. If you are a paralegal with upwards of 6 months family law experience and are keen to be considered for this York based role, please contact Helen Mauborgne on or submit your CV for consideration. To hear about other legal opportunities that we have available, please visit our website. Alternatively, if you know anybody who would be suitable for this role then please let them or us know as we offer a reward for successful referral. For full terms,  please visit our website. ",York,False,True
Senior Recruitment Consultant," Recruitment ConsultantSalary30,000 - 40,000 per annum  uncapped commissionJob LocationBristolInteraction Recruitment bristol are currently looking for experienced, ambitious and hungry Recruitment Consultants to work with our Experienced teamWe are looking for determined individuals who strive to achieve targets in an extremely fast paced environment who love delivering a second to none service to our customers and candidates alike. Hopefully you have worked in recruitment before but if not a sales  or account management background looking for a career change is just as goodThe role will involve· Managing the Recruitment Process· Building a portfolio of clients· Business Development - both face to face and on the phone· Creating job adverts· Creating marketing material· Pre-employment screening· Creating temporary AND permanent placement opportunities.We offer fantastic an outstanding commission system with additional bonuses to reward your success. 10% commission on all new business Year on Year monthly growth bonus Quarterly target bonusWe encourage our consultants to run their department as they would their own business. ",Bristol,False,True
Commercial Insurance Sales Executive," Commercial Insurance Sales Executive Our client is looking for a professional who has sales experience in the commercial insurance industry. Based out of their Central Manchester office, you will be a hungry to learn, positive client facing professional who is looking to expand their knowledge and have an opportunity to grow with an established broker. This broker has an already established team  but due to new investment want to grow their commercial arm and you will be working under a team of very experienced professionals to get the best out of this opportunity. If you have the desire to grow, know that your rapport building skills are second to none and want an opportunity to show exactly what kind of Sales Executive you can be, given the right opportunity, then this may be the chance you've been waiting for. There is a great opportunity to earn bonus, lead generation supplied, lots of warm leads, customers will be kept for the full life cycle which allows for more ownership, personal development and opportunity to cross sell. Salary dependent on experience 32,000 - 38,000 - Hybrid working. ",Manchester,False,True
Private Client Paralegal," Outstanding opportunity for a private client paralegal to join the this first class commercial Hull based practice who have a strong presence across Yorkshire. The quality of work is second to none and you will support the team of a range of private client matters including wills, probate, lasting powers of attorney, estate planning and trusts.  Previous experience as a private client paralegal is essential as are strong communication skills and a genuine desire to specialise in private client law. Offering a very inclusive culture with agile working and clear career development opportunities this is a stand out role in a very impressive business. If you are a paralegal with upwards of 6 months private client experience and are keen to be considered for this Hull based role, please contact Helen Mauborgne on or submit your CV for consideration. To hear about other legal opportunities that we have available, please visit our website. Alternatively, if you know anybody who would be suitable for this role then please let them or us know as we offer a reward for successful referral. For full terms,  please visit our website. ",Hull,False,True
Private Client/Legal Exectuive,"Private Client Paralegal/Legal ExecutiveLiverpool18,000 - 23,000Are you an experienced Paralegal/Legal Executive looking for an exciting new opportunity to join a team of award-winning Private Client lawyers and assist with a large case load?The role will be based in the Woolton office and would require at least 12 months experience in a similar role assisting with private client matters such as wills, probate, estates and LPA's.Your day to day would consist of opening files, updating clients, communicating with the probate registry, estate agents and other agencies. You will also be an excellent communicator, be able to work well in a team but also be a self-starter and always ready  to get involved.Please note all interviews will likely take place via teams or Microsoft teams and hybrid working will be available, the office location will be the Woolton office and interviews are already taking place. If you are considering a move and wish to be considered  for this role, please apply by sending your most recent CV to . Candidates with none of the above experience, who haven’t worked as a paralegal withinprivate client will not be considered!",Liverpool,True,False
Telesales Executive - Fitness Products Sales," Our client is a global market leader within Fitness Equipment industry. They continue to grow their international presence and are currently looking to recruit a Direct Telesales Executive to join their team and focus on selling into the USA marketplace. Responsibilities: To be responsible for increasing the turnover and profit of our clients organisation by growing the customer average order value, total value and order frequency. To be responsible for managing allocated territories to ensure you meet the agreed targets,  KPIs and objectives whilst adhering to the sales process. To be responsible for ensuring customer service is second to none by being pro-active in resolving issues and delivering outstanding customer service. We are looking for a true sales person with a 'competitive sales hunger’ who has a clear and demonstratble track record of sales achievement/success within previous positions. We are looking for candidates with a minimum of 3 years Telesales experience,  ideally within a large branded setting. In addition we are looking for candidates who have a strong interest whether this be professional or personal within fitness and wellbeing. The role will require the successful candidate to attend fitness conventions  and shows (UK), and be present on our clients stand, effectively immersing themselves fully within the company ethos. ",Peterborough,False,True
Private Client Solicitor," With offices in Reading and Henley on Thames, this Private Practice law firm is seeking to expand its well established and growing practice. As a full service law firm with an established reputation throughout Thames Valley and parts of London, it prides itself on its reputation and in particular its presence with national businesses and the local community as a whole. The quality and array of private client work you will be exposed to here is second to none.The ideal candidate will be 3-7 years’ PQE. You will be working with a team of 2 Solicitors and 2 private client paralegals. The firm looks to appoint aspirational individuals with a professional and friendly approach to their work. The department is responsible for:  Wills and trustsPowers of attorneyProbate and administration of estatesInheritance taxRetirement planningRights on deaths and illnessEstate and tax planning The role requires an individual with a can-do attitude and good commercial awareness for an opportunity to join this great firm.  Salary is competitive and there are super company benefits. To apply for this position please email with your CV or call Gayle Woolf for a confidential discussion at G2 Legal. #INDMAD ",Henley-on-Thames,False,True
Telesales Executive - Fitness Industry," Our client is a global market leader within Fitness Equipment industry. They continue to grow their international presence and are currently looking to recruit a Direct Telesales Executive to join their team and focus on selling into the USA marketplace. Responsibilities: To be responsible for increasing the turnover and profit of our clients organisation by growing the customer average order value, total value and order frequency. To be responsible for managing allocated territories to ensure you meet the agreed targets,  KPIs and objectives whilst adhering to the sales process. To be responsible for ensuring customer service is second to none by being pro-active in resolving issues and delivering outstanding customer service. We are looking for a true sales person with a 'competitive sales hunger’ who has a clear and demonstratble track record of sales achievement/success within previous positions. We are looking for candidates with a minimum of 3 years Telesales experience,  ideally within a large branded setting. In addition we are looking for candidates who have a strong interest whether this be professional or personal within fitness and wellbeing. The role will require the successful candidate to attend fitness conventions  and shows (UK), and be present on our clients stand, effectively immersing themselves fully within the company ethos. ",Peterborough,False,True
Senior Lettings Negotiator," Our client is the number 1 Estate Agent in Surrey. Established 20 years ago they have 20 offices around the county. They are independently owned so have an excellent blend of corporate stability but a flair for freedom and independent working. Through excellent  habits and practises our client has cemented themselves as the best Estate Agent in the area, and have an excellent reputation with their customer base. In terms of career progression and opportunity there are none better to help already talented professional's  achieve their potential and more.• 23,000 basic Salary  uncapped commission• Very successful Lettings office• Market leaders in County• Office achieves 100 lets a month• Excellent training and development• Culture of internal promotionsOur client is looking for talented Lettings staff who have an excellent track record in high volumes of lets whilst maintaining high standards. Help maintain and grow our clients already huge Landlord portfolio and look after the Lettings process from start  to finish; Tenant enquiries, viewings, offer negotiation, and all the relevant checks. For further information please call Genum Recruitment. ",Staines-upon-Thames,False,True
Child & Adolescent Psychiatry Consultant," Job Title: Consultant Child and Adolescent Psychiatrist Grade: Consultant Specialty: Child and Adolescent Psychiatry Dates: 31st March until 30th June Working Pattern: Monday to Friday, 40 hours per week On-Calls: None Location: Dsiclosed upon connection. About the Role: We are seeking a Consultant Child and Adolescent Psychiatrist to join our team for a temporary position from 31st March until 30th June. This role involves working Monday to Friday, 40 hours per week, with no on-call duties. Requirements:  Candidates must be on the specialist register.Recent UK experience in Child and Adolescent Psychiatry is essential.Applicants must have a fully compliant CV, including an in-date fit-to-work health clearance, a valid CRB/PVG check, two recent UK references, passport, and immigration check (if not a UK national).The charge rate for submitted CVs should be clearly stated, including the doctor's pay rate and other charges. How to Apply: If you meet the requirements outlined above and are available for the specified dates, we encourage you to apply. Please submit your fully compliant CV. ",Kirkcaldy,True,False
Legal PA - Sports Law! - £42k - 50 WFH," Legal PA - Sports Law! - 42k - 50% WFH A highly sought after, international law firm are seeking a new Legal PA with around 2 years experience to support 2 friendly Partners in their leading Sports Law department! You will be working alongside a number of similarly experienced Legal PA's as this  role sits in one of their largest departments.   Salary 42,000Hybrid working: 50% from homeAnnual discretionary bonus25 days holiday The support network at this firm is 2nd to none and you can rely on large document production centre to complete all the lengthy documents which makes the role a true representation of a 'PA' role whereby you have more time to provide administrative support  to the Partner and Fee Earners!  The role will include:  Diary management,Arranging meetings/conferences,International travel arrangements,Submitting expenses/time sheets Some document amendments.  In order to be considered for this role you need at least 2 years Legal Secretary / PA experience within a recognised legal environment. Please contact Adam @ JM Legal for further information.  ",London,False,True
CONVEYANCER," Salary: 22,000 - 30,000 p.a., depending on experience Hours: full time Join a thriving and expanding law firm in West Yorkshire as a Residential Conveyancer - various locations (salary up to 30,000). This firm will also consider Trainees or more junior candidates for their team in an Assistant capacity (salary up to 22,000).  You will already have experience of running your caseload from initial instructions through to post completion with a natural interest in maintaining excellent levels of client care and service delivery. The caseload will include:  Sales  PurchasesLeaseholdFreehold For this role you must have previous experience as a Conveyancer and familiarity with case management. Conveyancer / Conveyancing Fee Earner West Yorkshire - various locations (Bradford / Wakefield)  Clark Legal provides a very personal, caring and confidential service, second to none. It welcomes applications from all sections of the community and tries to ensure that all clients for which it recruits select staff solely on the basis of their merits,  abilities and potential, regardless of age, disability, race, religion or belief, gender, sexual orientation, socio-economic background, political beliefs and affiliations, family circumstances or other irrelevant distinctions. ",West Yorkshire,False,True
CONVEYANCING PARALEGAL," Salary: up to 24,000 Hours: full time, hybrid working (part office, part home) A fantastic opportunity for a Paralegal with Conveyancing experience to join the Property department of this modern firm working in their central Leeds office. Working within a specialist Conveyancing area, you must have some experience within the Conveyancing  field. Duties will include:  Managing your own caseload of transactionsCommunicating with all parties and keeping them updatedUtilising a case management systemAccessing Land Registry searches The ideal candidate will have an LLB or conversion graded 2:1 or above. Property Paralegal Conveyancing Leeds city centre Clark Legal provides a very personal, caring and confidential service, second to none. It welcomes applications from all sections of the community and tries to ensure that all clients for which it recruits select staff solely on the basis of their merits,  abilities and potential, regardless of age, disability, race, religion or belief, gender, sexual orientation, socio-economic background, political beliefs and affiliations, family circumstances or other irrelevant distinctions. Information supplied to Clark  Legal will be retained confidentially as appropriate and used solely as part of your job search. ",Leeds,False,True
Corporate Solicitor," A top tier regional law firm is seeking a Corporate Solicitor to join its large and highly regarded corporate team in Newcastle. This Corporate Solicitor opportunity is offered on a full-time permanent basis with flexible and agile working options accommodated.  Excellent salary commensurate with experience.The RoleAs a Corporate Solicitor in this team, you would:- Advise on mergers and acquisitions, disposals, buy-ins and buyouts, IPOs, secondary fundraisings, takeovers, joint ventures and investments.- Act for national and international clients including corporates, private equity institutions and management teams.About YouTo be successful in your application for this Corporate Solicitor vacancy, you will have:- A minimum 2 years' PQE in corporate law- A strong academic background.- A good teamwork ethic.- Good client skills and a keen interest in business development.The OfferingThe successful Corporate Solicitor will be rewarded with:- A highly competitive salary, bonus and comprehensive benefits package.- Second-to-none training and development- Clear progression opportunities.- The opportunity to work on a wide range of corporate transactionsTo be considered for this Corporate Solicitor vacancy, apply here with an up to date copy of your CV or contact us for further information. ",Newcastle Upon Tyne,False,True
Telesales Advisor/Executive - Fitness Products," Our client is a global market leader within Fitness Equipment industry. They continue to grow their international presence and are currently looking to recruit a Direct Telesales Executive to join their team and focus on selling into the USA marketplace. Responsibilities: To be responsible for increasing the turnover and profit of our clients organisation by growing the customer average order value, total value and order frequency. To be responsible for managing allocated territories to ensure you meet the agreed targets,  KPIs and objectives whilst adhering to the sales process. To be responsible for ensuring customer service is second to none by being pro-active in resolving issues and delivering outstanding customer service. We are looking for a true sales person with a 'competitive sales hunger’ who has a clear and demonstratble track record of sales achievement/success within previous positions. We are looking for candidates with a minimum of 3 years Telesales experience,  ideally within a large branded setting. In addition we are looking for candidates who have a strong interest whether this be professional or personal within fitness and wellbeing. The role will require the successful candidate to attend fitness conventions  and shows (UK), and be present on our clients stand, effectively immersing themselves fully within the company ethos. ",Peterborough,False,True
Telesales Direct Sales Executive - Fitness," Our client is a global market leader within Fitness Equipment industry. They continue to grow their international presence and are currently looking to recruit a Direct Telesales Executive to join their team and focus on selling into the USA marketplace. Responsibilities: To be responsible for increasing the turnover and profit of our clients organisation by growing the customer average order value, total value and order frequency. To be responsible for managing allocated territories to ensure you meet the agreed targets,  KPIs and objectives whilst adhering to the sales process. To be responsible for ensuring customer service is second to none by being pro-active in resolving issues and delivering outstanding customer service. We are looking for a true sales person with a 'competitive sales hunger’ who has a clear and demonstratble track record of sales achievement/success within previous positions. We are looking for candidates with a minimum of 3 years Telesales experience,  ideally within a large branded setting. In addition we are looking for candidates who have a strong interest whether this be professional or personal within fitness and wellbeing. The role will require the successful candidate to attend fitness conventions  and shows (UK), and be present on our clients stand, effectively immersing themselves fully within the company ethos. ",Peterborough,False,True
SENIOR CONVEYANCING ASSISTANT - HYBRID," Salary: up to 26,000 p.a. Hours: full time (35 per week), hybrid (2 days WFH) A fantastic opportunity for an experienced Conveyancing Assistant to build upon any previous experience and work for this very friendly, long established law firm in Wakefield. As a Senior Conveyancing Assistant, you will be working closely with a Fee Earner,  supporting them with all aspects of the Conveyancing process from outset to completion. Your duties will include:  Setting up files for completionDealing with ExchangesManaging Sales transactions under minimal supervisionClient care/ updatesAssisting on more complex transactions. You should have 3 years experience within Sales and Purchase Conveyancing. Conveyancing Assistant Residential Conveyancing Wakefield Clark Legal provides a very personal, caring and confidential service, second to none. It welcomes applications from all sections of the community and tries to ensure that all clients for which it recruits select staff solely on the basis of their merits,  abilities and potential, regardless of age, disability, race, religion or belief, gender, sexual orientation, socio-economic supplied to Clark Legal will be retained confidentially as appropriate and used solely as part of your job search. ",Wakefield,False,True
Business Travel Manager," Urbanberry Recruitment are excited to advise we are recruiting for a fantastic opportunity based in London 5 days a week for a Business Travel Manager.  This is a position which demands exceptional knowledge of the TMC market and of the operational side of running a successful business travel department. The Manager will be a very hands on manager getting involved with the day to day bookings as well as helping/supporting and training the team. We’re looking for someone who places focus on raising the bar when it comes to delivering a Business Travel service that is second to none and sets them apart from competitors. For this hands on Manager position our client would ideally like someone who has previously been a Manager however they would consider someone looking for that next promotion.. Daily duties will include an array of tasks such as:   Ensuring levels of productivity within the team are high  Taking a hands on approach to assisting the team with bookings   Staff reviews, training- you’ll have a responsibility to ensure you get the best out of your team and support them in their careers  This is a Monday- Friday office based position where you will be rewarded for your hard work with a generous salary and discretionary performance related bonus. ",London,False,True
Graduate Software Developer,"Junior Software DeveloperSalary: 23,000 – 25,000Location: Remote – Monthly trips to the Shrewsbury OfficeWe are working on behalf of one of the UK’s most successful automotive organisations who are looking for a graduate software developer to come and work within a really talented and driven development function. The business will offer a second to none level  of support to the successful candidate, training and developing them in a range of cutting edge technologies.This is the type of role where the successful candidate will have exposure to a range of projects from the get go, and will have the ability to make their mark from day 1.The successful candidate will be - University educated within a computer science discipline.Passionate about programming and the desire to learn new languages and technologies.Mature in their approach – this role will be predominantly remote working so the successful candidate must be self-motivated.Excellent written and verbal skillsA natural problem solverExperience of a technical language such as Java, C#, .NetDrivers License This is an exciting opportunity to work within an organisation that has the time and desire to train a graduate, you will have access to regular training afternoons, will get involved with pair and mob programming techniques and you will have a genuine path  for progression.For further details please contact Sash or on ",Harlescott,False,True
