Job Title,Job Description,Location,Part-time,Full-time
Graphic Designer ," Graphic Designer  Harrogate  30k pa  We are looking to recruit an experienced Graphic Designer for our client a global manufacturing business within Harrogate The successful candidate will work in the Marketing Department and will work with different multimedia features such as graphics, digital photography, 2D/3D modelling, animation and video, to craft captivating visual designs for branding, websites, digital  displays and brochures. From concept to completion, you will be the creative brain to bring ideas to life. This is a fantastic opportunity for a candidate to further their career in graphic design while working alongside a friendly and supportive creative team. To be successful in this role, you will have a keen eye for detail, have an innovative creative approach and excellent communication skills. The Graphic Designer will be responsible for creating marketing materials through various types of media. This includes:  Develop and refine visual concepts, ensuring alignment with brand guidelinesCreate branded digital and printed assets to promote the businesses solutionsUsing creative ability to engage followers on social media by promoting the companies solutions and initiatives. Essential Skills for the Graphic Designer:   A degree in a graphic design or similar is preferable but evidence of experience gained in a corporate Graphic Design or Multi-Media Design position would be accepted.Can showcase your creative prowess through a diverse portfolio.Are passionate about creating exceptional design, typography, and branding.An expert in Adobe Creative Cloud with proficiency in Adobe Illustrator, Adobe InDesign, along with Figma, Photoshop.Excellent communication and presentation skills, with the ability to articulate design concepts clearly.Are a team player, self-driven, collaborative, and adaptable.Experience creating both print assets such as packaging and labelling and digital media. Desirable Skills for the Graphic Designer :   Have knowledge of web app and native app design, UX/UI principles, and cross-platform applications.Experience in dealing with professional printing servicesPhotography experienceVideo experience such as working with Premier Pro/After EffectsHTML / CSS The candidate must have at least three years of experience in a similar role and also:  Be a strong communicatorAvailable to undertake national and international travelHave excellent time managementCreative minded personality, ability to think out of the boxHave the ability to manage multiple projects and meet deadlinesBe a team playerHave an eye for detail Please note this is a full-time permanent position. Package for the Graphic Designer :  The successful candidate can expect to receive a highly competitive package including:  Private Health careLife assurancePermanent Health InsuranceEmployee Assistance ProgrammeFlexitime working (after 6-month probatory period)Quarterly BonusEnhanced Maternity/PaternityCompany pension plan23 days annual leave  statutory holidaysCycle to Work SchemeEye Test/Glasses ContributionsBenefits HubRefer a Friend Scheme - 500 each (subject to NI/Tax Deductions)Free ParkingBirthday VoucherCompany funded charitable working (3 days per annum)National and International travel opportunities This is a rewarding and challenging role within an innovative global company where potential is more important than expertise. If you are a proactive, confident team player who believes their marketing skills can make a real impact on our business, please  submit your CV and portfolio. ",Harrogate,False,True
Graphic Designer," Join a well-established creative agency, uniquely specialising in print design as a Graphic Designer. Their diverse customer base spans the UK, offering various projects that promise variety and challenge. You will be working in the creative city centre of Sheffield. THE JOB:- Working in a busy commercial design studio designing and creating brochures, flyers, leaflets, folders, business stationery, re-brands, packaging, magazines, displays, website concepts signage, large format and much more- Account management of larger graphic design customers- Provide graphic support for online marketing activities such as the website, email marketing and banner advertisements- Manage the delivery of graphic design projects to brief and deadline- Preparing artwork and creating print-ready files- Dealing with customers on a day-to-day basis by phone, email and face-to-face KEY SKILLS  EXPERIENCE:- 2 years of recent experience in Graphic Design- Excellent knowledge of CorelDraw and Adobe software suites- Ability to work under pressure and manage multiple projects- A good eye for detail to deliver professional and accurate artwork- Excellent English skills - written, verbal and grammar- Excellent project management and communication skills- Reasonable commute from Sheffield. SALARY  BENEFITS:- 25,000 - 30,000, dependent on experience- 25 days holiday  public holidays- Free onsite car parking- Training and development courses Please apply today by sending your CV for immediate consideration. No overseas applicants please; visa applications cannot be considered. ",Sheffield,False,True
Graphic Designer," Graphic Designer with Marketing Support  Newport  26,000 - 28,000 per annum  excellent benefits Yolk Recruitment are proud to be partnered with a prestigious brand that has a major profile within the Welsh market who are currently hiring for a Graphic Designer to join their Newport based team. You will be a forward-thinking individual who can work within a fast paced ever changing environment. You will need to be a person who isn't afraid to get stuck in and be on hand to support other members of the Marketing team with tasks outside of Graphic  Design in addition to your more traditional Design responsibilities. A passion for creative content coupled with the desire to consistently develop through learning is essential.  Here's what you'll be doing:  Meeting with members of the broader organisational team to take briefs and gather relevant information in order to produce creative and innovative marketing design solutions.Interpreting and developing briefs to design marketing literature including brochures, flyers, adverts, posters, event material and all digital assets.Maintaining and adhering to brand guidelines and developing these in line with the growth and development of the brand.Working and liaising with the marketing director and teams to ensure that marketing material is produced to the highest standard and to meet deadlines and budgets.Briefing and liaising with photographers and printers in the technical production of print and photographic and digital material. Manage photo and digital libraries.Prioritising of workload to meet deadlines, managing several design briefs at any one time.Using Apple Mac design software and packages including Photoshop, Illustrator, InDesign, Acrobat, Flash, Dreamweaver and Microsoft Word.Obtaining quotes as required for print and merchandise, outsourcing etc.. and for issuing purchase requisitions numbers or following finance procedures in place.Assisting with the digital strategy and design to include maintaining content for the website, design of web pages, layout for existing and new web developments. Add creative content, banners and images to support any digital activity including external  websites. The skills and experience you'll bring to the team:  You'll have proven experience in Graphic Design and will be able to share an up-to-date portfolio of your work.You'll be a self-starter who is eager to develop skills in addition to Graphic Design - your role will involve supporting another member of the Marketing team with areas such as Social Media scheduling and Content Creation, so the willingness to support  in areas outside of Design is essential.You'll be passionate about brand identity and will have an understanding of the importance of correctly representing partnership brands on Marketing materials.You'll enjoy working to creative briefs and be comfortable when managing multiple projects at one time.You'll be driven and keen to learn and build on your existing skillset. Here's what you'll get in return:  Heavily discounted meals, hotel rooms, spa treatmentsDiscounted/free eventHeavily reduced 5* gym membershipPension scheme24 days holiday  bank holidaysFree and secure on-site Parking ** Please note, this is predominantly an on-site role, you will be required to be on site in Newport for 4 days per week, with 1 day working remotely** Are you up to the challenge?If you believe that you have the skills and experience for the role - then please get in touch by uploading your CV as a Word document to this advert. We also offer a referral scheme for any candidates whose details are passed to us that we successfully place.  If you have any further questions then please contact Kim Partridge.Yolk Recruitment Ltd acts as an employment business for temporary positions and an employment agency for permanent positions. Yolk Recruitment Limited is committed to equal opportunity and diversity. Suitable candidates with equivalent qualifications and more  or less experience can apply. By applying for this job you accept the TC's, Privacy Policy and Disclaimers which can be found at YolkRecruitment. ",Langstone,False,True
Graphic Designer," Time Appointments are excited to be recruiting for a large specialist marketing agency based in Suffolk who are looking for a creative, passionate and innovative Graphic Designer to join their team! Key Responsibilities:· Design posters, brochures, logos, Social Media content, websites, database marketing, annual reports, advertisements, and other communication materials, from concept to completion, including videos and digital formats. · Create these materials by using Adobe's Creative Suite - including Photoshop, Illustrator, InDesign, and more.· On occasion, liaise directly with clients to gain an understanding of what they want their proposed communications to look like. · Produce drafts, based on written or verbal briefs, for review by clients and make revisions based on the feedback received from the Account Manager.· Liaising with external printers on a regular basis to ensure deadlines are met and material is printed to the highest quality.· Partake in company wide brainstorms and pitch creative ideas that enhance projects both internally and direct to clients Skills  Experience Required:· A minimum of 1 years’ experience in a Graphic Design role is preferred · Understanding of WordPress (or other PHP based) Content Management Systems, and Creative Suite (InDesign, photoshop, illustrator)· Knowledge using responsive design techniques for web and email· Experience with Social Media platforms · Experience using Gmail and the Google suite of products - sheets, docs and slides · Experience of preparing artwork for print and creating digital designs· Understanding of visual elements (layout, type and fonts)· Able to translate client and Account Manager requests into visually impactful designs · Strong communication skills, written and verbal · A keen eye for detail· Time management, multitasking abilities, deadline driven· Highly organised and problem solving skills· Proficient using a Mac · Driving licence, due to location of office Benefits: Hybrid workingLearning and Development plan25 days paid holidaySocial eventsEarly finish on Fridays! The successful candidate will be required to creative inspirational and engaging designs whilst demonstrating a sharp eye for visual detail and producing high quality work. If you are passionate about design, eager to learn and are keen to join a dynamic team with an exciting client portfolio - we want to hear from you! V/12601 ",Bury St. Edmunds,False,True
UI Developer," A UI Developer is sought after to join a leading financial services client of mine. This role requires a keen eye for design and proficiency in React.JS. Client Details This company has been a prominent player in the financial services sector for the last 30 years, with a workforce of over 500 employees globally. You'll be based out of their London office, which sits in the heart of the city.  Description Your Key responsibilities as a UI developer will include but will not be limited to:  Designing user-friendly interfaces for web applicationsCollaborating with the development team to implement design conceptsLiaising with Portfolio Managers, Traders and other developers to ensure the completion of the projectCreating and maintaining UI documentationAdhering to company standards and industry trends in designProviding technical support to team members when neededParticipating in team meetings and providing input on UI design strategy Profile A successful will have the following experience:    Ability to commute to the London office 5 days per week   A degree in Computer Science, Design or a related field  Proficiency in HTML, CSS, React.JS   Experience in creating and implementing UI designs  A strong portfolio showcasing a variety of UI design work  Excellent problem-solving skills and attention to detail  Strong communication skills to effectively collaborate with team members  As a bonus they will have experience:   utilising PythonWorking and liaising with front office teams  Job Offer On offer for a successful candidate is the ability to earn up to 750 per day Outside IR35 for an initial 12 month period with the possibility of an extension working fully on-site 5 days per week.  ",London,False,True
Graphic Designer," Graphic Designer (Manufacturing) Weston Super-Mare 26,000 - 33,000  Training  Progression  Benefits Are you a Graphic Designer looking to join a well-established signage design company, that have built a fantastic reputation for providing a wide range of high quality industry designs for prestigious national clients?  Do you want to work within a skilled team of creative, likeminded people working across a range of signage designs for high-end clientele? On offer is a brand new opening for a Graphic Designer to join a bespoke company who manufacture's and install's stylised signs for clients that span across the UK. This company offer a vast array of products and services all increasing the awareness of  branding and marketing. In this role, the successful Graphic Designer will be a senior, designing graphics for national clients and liaising with them to achieve the client's needs. You will use your creative eye to make the business stand out from the rest and your social skills  to be build up relationships for the long term. The ideal Graphic Designer will have an interest in working local to Weston-Super mare. Ample background in Graphic Design. Signage industry background would be ideal with a very lucrative portfolio. The Role:   Designing and doing practical drawingsLiaising with clientsworking on national projects The Person:  Graphic design backgroundBackground with adobe suite - Illustrator, InDesign and photoshopIdeal signage industry backgroundLocal to Weston Super-Mare Keywords: IT, website, web Design, Design, Digital Design, Designer, IT Design, Social Media, Social Media Posts, Designer web, Social Media Design , Graphic Design, Graphic Designer, Graphic Reference: BBBH12470 If you're interested in this role, click 'apply now' to forward an up-to-date copy of your CV, or call us now. If this job isn't quite right for you but you are looking for a new position, please contact us for a confidential discussion on your career. Ernest Gordon Recruitment Limited acts as an employment agency for permanent recruitment and employment business for the supply of temporary workers. By applying for this job, you accept the TC's, Privacy Policy and Disclaimers which can be found at our  website. ",Weston-super-Mare,False,True
Graphic Designer," Reed Marketing and Creative are looking for a talented Mid Weight Designer to join their client based in Central Bristol. With at least two years of experience, the ideal candidate will have a strong portfolio showcasing their expertise in design for a  variety of marketing content. This role requires a self-starter with a creative flair, excellent knowledge of design software, and the ability to manage multiple projects efficiently. Benefits:  Flexible working hours, Monday to Friday 9-5 (35 hours per week), with the option for remote work up to 3 days per week.26 days annual leave plus bank holidays, with the option to buy an additional 5 days and carry over.7% employer pension contributions.Free Legal Expenses Insurance and Motor Breakdown Cover.Health Cash Plan and gym subsidy worth up to 25 pcm.Cycle scheme and interest-free commuter loans.Company Sick Pay and enhanced Parental Leave.Complimentary coffee, tea, squash, and biscuits.Free company events and socials.Support for learning with time allocated for study and exams. Key responsibilities:  Work within the Marketing team to ensure consistent and accurate adherence to the Group Corporate Design/Brand Guidelines.Produce and implement high-quality brand visuals for various marketing content, including updating company literature, creating digital and print advertising, emails, e-shots, and social media content.Maintain digital assets in line with Group brand guidelines.Develop and follow design briefs/projects, presenting quality designs that fit the brand and meet the needs.Deliver design projects on time and within the brief.Provide ongoing support to internal or external customers on creative queries, analysis, or requests.Take responsibility for personal learning needs and objectives, working closely with colleagues to progress knowledge and skills. Person Specification:  Minimum of two years’ experience as a designer, with a strong portfolio.Proficiency in InDesign, Photoshop, Illustrator, and PowerPoint.Ability to produce magazines, brochures and flyers is essentialMust be organised with high attention to detail and a creative flairStrong time management skills and the ability to handle multiple projects.Confidence in taking design briefs and developing projects following brand guidelines.Attention to detail and accuracy of work.A proactive approach to learning new technology and staying up to date with trends and tools.A degree in design, related qualification, or marketing qualification is advantageous.Experience in animation software (AE) or willingness to learn is a plus. ",Bristol,False,True
Web Designer,"Web Designer | Middlesbrough | 25,000 | On-site | Learning and DevelopmentAt Ada Meher, we are working with an established business in the UK. Our client is a leader in the automotive world and is now searching for a web designer to join their IT team and enhance the overall satisfaction and usability of their website.The role involves supporting the migration of their existing software to the browser and the development of new business and customer-facing web portals and shopping sites.Requirements: Designing, developing, and testing site functionality and usabilitySEO practicePhotoshop and IllustratorHTML5, CSS, and JavaScriptWebsite creation, graphic design, and web developmentBranding principles, typography, and colour theoryRelevant degree qualification and minimum1 or 2 years experience in a similar role The company also focuses on fostering a warm and welcoming work environment and offers lots of mentorship and support throughout your career. To be considered, please attach an up-to-date copy of your CV and we can discuss the full job description, salary, and benefits on our initial briefing call. You can also contact me at ",Darlington,False,True
Web Designer,"Web Designer | Middlesbrough | 25,000 | On-site | Learning and DevelopmentAt Ada Meher, we are working with an established business in the UK. Our client is a leader in the automotive world and is now searching for a web designer to join their IT team and enhance the overall satisfaction and usability of their website.The role involves supporting the migration of their existing software to the browser and the development of new business and customer-facing web portals and shopping sites.Requirements: Designing, developing, and testing site functionality and usabilitySEO practicePhotoshop and IllustratorHTML5, CSS, and JavaScriptWebsite creation, graphic design, and web developmentBranding principles, typography, and colour theoryRelevant degree qualification and minimum1 or 2 years experience in a similar role The company also focuses on fostering a warm and welcoming work environment and offers lots of mentorship and support throughout your career. To be considered, please attach an up-to-date copy of your CV and we can discuss the full job description, salary, and benefits on our initial briefing call. You can also contact me at ",Darlington,False,True
Graphic Designer," Graphic Designer – Belfast - Temporary REED Technology are delighted to partner with an educational organisation who are seeking to recruit a Graphic Designer to join their excellent team. The Graphic Designer will be responsible for the design production of a range of high quality marketing campaigns, materials and publications, using a wide range of expert graphic design skills and technology. This will include;  Delivering a range of materials for the organisation through use of digital and design technologyWorking closely with Marketing Communications colleagues and the wider Marketing team, to extract high quality briefs and develop, deliver campaigns and materials.Supporting the implementation of a clear brand positioning through design of a wide range of materials and campaigns that consistently reflect the brand Responsibilities:·Work with the compnay to extract high quality creative briefs  Collaborate with other specialist staffPresent ideas to colleagues and stakeholders and take directionDesign and produce a wide range of print and digital materials including, web design, social media content, HTML e-zines, brochures, trade show graphics, newsletters, screen displays, print advertising, signage and email templates.Manage multiple projects simultaneously, establish priorities, working well under tight deadlines and maintain deadlines.Edit and review all final designs and layouts produced for accuracy and quality.Suggest improvements and modify formats to increase the quality of production and ensure brand guidelines are met.  Using a wide range of specialist design packages, plan and deliver design content, to deliver a strong visual aesthetic.Review all material produced to ensure consistency with Brand including styling and imagery guidelines.Manage internal Creative Services assets, including image/file cataloging, archiving, backup system, and post final files to network and online storage locations.Act as a key team member, be a challenging and innovative force within the team, suggesting new ways of delivering our commercial objectives. Essential Criteria  Degree in Graphic Design, Multi-media Design, Visual Communication or closely related subjectExperience in the production of highly complex graphic materials, diagrams and images for use in web design and production of printed materials.Working knowledge and experience in copyright and licensing laws and digital rights management. If you meet the above criteria, then I would like to hear from you asap. Please contact Niall Lennon on for a confidential discussion. ",Belfast,False,True
Product Designer UI/UX," Our client, a highly dynamic and successful company based on the outskirts of Exeter, requires Product Designer (UI/UX) to join their team. This is an in-office role, with flexibility to work from home up to 2 days per week. Product Designer Responsibilities include:  Running research sessions to gain insights into user needs and behaviours and combining them with business requirementsApplying UX design principles and creating quality innovative prototypes for testing and iterationWorking alongside other Designers, Engineers, Product Owners and Senior Leaders. Working within Agile scrum teams, to generate ideas and ensure high-quality designs translate into solutions that work for usersTranslating your prototypes into engaging, intuitive and responsive UIs About You:  Commercial experience in a Product Design, UX or UI Design roleStrong skills in UX Design: wireframing, prototyping, information architecture and journey mappingExperience in UI Design, with a strong understanding of UI patterns, web accessibility and great attention to detailExperience designing, conducting, analysing and responding to user researchGreat communication skills to effectively collaborate with a range of stakeholders, explain your ideas and thought process Package:  Up to 55k DOEPension matching (up to 5%)Private Medical Insurance Private Dental InsuranceEyecare voucherFlu VaccinationsAnnual leave - 25 days Note on Sponsorship: We are unable to offer sponsorship for work authorisation for this role. Therefore, candidates must possess valid authorisation to work in the UK without requiring visa sponsorship.  Recruitment Consultant: Conor Mellamphy ",Exeter,False,True
