Job Title,Job Description,Location,Part-time,Full-time,Graduate,Minimum Salary
Management Accountant - CleanTech AI Startup - London," Management Accountant - CleanTech AI Startup - London Flexible Hybrid 50,000 - 60,000  benefits TalentEdge are currently searching for a talented accountantto join an exciting AI startup based in London. This position offers a unique opportunity to support the financial reporting and technical accounting functions within a dynamic and rapidly growing  tech company. Responsibilities:  Preparation of accurate and timely financial statements, including monthly, quarterly, and annual reports.Supporting the technical accounting function, providing guidance on complex accounting issues such as revenue recognition and stock-based compensation.Develop and maintain financial policies, procedures, and documentation to ensure compliance with regulatory requirements.Partner with cross-functional teams to provide financial insights and support strategic decision-making.Manage relationships with external auditors, tax advisors, and other financial service providers. Qualifications:  Fully qualified accountant with extensive experience in financial reporting and technical accounting.Previous experience working in a scaling tech company or startup environment is highly desirable.Strong knowledge of GAAP and IFRS accounting standards.Excellent analytical and problem-solving skills.Strong communication and interpersonal skills. ",London,False,True,,0.0
"Data Consultant, Data Analyst, or Data Scientist"," Salary up to 50k plus extensive benefits and Company profit bonus Once upon a time in the bustling realm of data innovation, there existed a young and vibrant company. Nestled at the heart of this company was a culture that thrived on putting clients first and solving their most intricate data puzzles. Every member of  the team was a hero in their own right, wielding the power of data to conquer challenges and find hidden insights. Our story begins with you, a talented individual seeking not just a job, but a calling in the realm of data. As a Data Consultant, Data Analyst, or Data Scientist, you step into a world where every day brings new adventures and opportunities for growth.  Your journey starts with the freedom of remote work, knowing that every few weeks, you'll gather with your fellow comrades in the vibrant city of London or the enchanting landscapes of South-East England. But what truly sets this company apart is its commitment to nurturing a culture of innovation and agility. Here, in this dynamic environment, your role is not confined to a mere title; it's a canvas waiting for your creative strokes. Imagine crafting prototypes  of data solutions alongside our esteemed Product Team, breathing life into ideas before they embark on their development journey. Picture yourself as the guardian of data integrity, identifying areas of concern and devising ingenious strategies to weave the  fabric of our data systems tighter. Your days are filled with the excitement of cleaning and analysing vast datasets, wielding an array of tools and techniques like a seasoned warrior. With Knime as your trusted ally in the ETL process, you delve deep into the realms of data, extracting pearls  of wisdom to illuminate the path forward. And as you collaborate with cross-functional teams, your contributions become the mortar that fortifies the walls of our company's growth. But amidst the exhilaration of your quest, there lies a profound sense of purpose. For within the corridors, you're not just a Data Manager, Analyst, or Scientist; you're a catalyst for change. Your knack for problem-solving, your thirst for innovation,  and your unwavering commitment to excellence propel us ever forward. Together, we unlock the potential of data, transforming challenges into triumphs and dreams into reality. So, if you're ready to embark on an epic journey where every challenge is an opportunity, every success is a victory shared, and you have Knime or Alteryx experience, apply!.  Together, let's write the next chapter in the saga of data innovation, where heroes are forged and legends are born. Please note you must be eligible to pass an advanced DBS check once you are offered a role with this company. This company is not able to offer sponsorship I am afraid! Any questions contact Zoe Caplan-Williams at Vermillion Analytics  ",London,False,True,,40000.0
Digital Operations Manager," Matchtech are looking to make a hire for a Digital Operations Manager for our public sector client. Our client is transforming and improving its Digital services to help improve and enhance the community services that it delivers each day. The role is newly created and will sit within the digital transformation team. The successful post holder will be responsible for ensuring that the digital products delivered are aligned with customer and business requirements. On a daily basis you will be managing the operation of digital solutions and services, thus supporting the delivery of these services. Key Responsibilities:  Providing support for new solutions and services and getting business ready for go-live.3rd party support and liaison with Digital Services providers.Supporting the development of a digital product roadmap Core Skills for this role:  A strong understanding of Local Government Enterprise SolutionsA strong proficiency in applying software which enables the user to create, populate and manipulate digital services and data.An understanding of Council Digital platformsKnowledge and understanding of existing and emerging Digital  Cloud technologies.Appreciation of Software coding, aspects of AI, automations, data Modelling, visualisation, and NoSQL databases *It will be advantageous to understand the risks and trends affecting Digital services within the local government arena.Expert knowledge of Digital service delivery. Our client offers a hybrid working charter with a 2-day minimum of office working near to Waterloo station. If this role sounds of interest and you'd like to know, please feel free to send us your latest CV. We will endeavour to make contact within 72 hours. ",London,False,True,,55000.0
Global Data Platform Manager BI," Practice Group / Department: Business Intelligence - Australia Job Description We're Norton Rose Fulbright - a global law firm with over 50 offices and 7,000 employees worldwide. We provide the world’s preeminent corporations and financial institutions with a full business law service. As well as the relevant skills and experience, we're  looking for people who are innovative, commercial and value the work that they do. To attract the best people, we strive to create a diverse and inclusive environment where everyone can bring their whole selves to work, have a sense of belonging, and realize  their full career potential. We value difference and actively promote a culture of respect for each individual, encouraging and creating inclusion. Our new hybrid working model allows our people to have more flexibility in the way they choose to work from  both the office and a remote location, while continuing to deliver the highest standards of service. We offer a range of family friendly and inclusive employment policies and provide access to programmes and services aimed at nurturing our people’s health  and overall wellbeing. Job Summary We are seeking an experienced professional with a strong background in data processing and platform management to join our dynamic Business Intelligence (BI) team. As the Data Platform Manager (BI), you will play a pivotal role in empowering data driven  decision-making across the organization. You will balance maintaining stable BI systems with an agile operating model that is highly responsive to the consistently evolving business requirements. In this role, you will be responsible for processing complex  data sets from source systems to various curated data consumption platforms such as Tableau and Power BI. The ideal candidate will have a deep understanding of data processing methodologies, excellent analytical skills, flexibility to work across multiple time zones, proficiency in working with multiple structured and semi-structured data sources, and a proven  ability to manage key relationships with both business stakeholders and the various IT groups globally. You will have experience managing projects with both functional and technical stakeholders to deliver enhancements and continually drive innovation. Additionally,  you will play a crucial role in creating and publishing documentation (for both a technical and business users) to support the global Business Intelligence (BI) function. Responsibilities:  Data Processing: Transform raw data from source systems into curated datasets for end-user consumption.BI Platform Management: Oversee globally deployed BI systems, assess new deployment opportunities, and ensure seamless integration.BI Platform Development: Collaborate on the development and implementation of business intelligence systems.Data Pipeline Implementation: Design and implement data processing systems, including data pipelines and flows.Translate Business Needs: Bridge the gap between business requirements and technical specifications to create solutions to meet business needs.Data Sharing Procedures: Establish robust data sharing procedures with internal and external stakeholders, ensuring compliance with the jurisdictional data privacy laws and regulations.Data Visualization: Manage data visualization platforms for presenting curated information.Cross-functional Collaboration: Work closely with cross-functional teams to gather data requirements, define data set rules, and implement processing capabilities.Documentation: Create and maintain comprehensive documentation, including data reconciliation processes and procedures, SOPs, and technical guides.Knowledge Management: Publish and maintain documentation in accessible repositories for team members and stakeholders.Subject Matter Expertise: Act as a data processing subject matter expert, providing guidance and support.IT Collaboration: Collaborate with IT teams to enhance data tools, systems, and processes, contributing to data governance initiatives.Balancing High Availability and Agile Enhancements: Ensure high availability of BI systems while actively participating in agile enhancements to drive innovation and responsiveness to changing business needs.Environment Monitoring: Proactively monitor the data processing environment and address issues in collaboration with relevant teams. Identify and implement tools for the proactive monitoring.Stay Current: Stay informed about industry trends, emerging technologies, and best practices in data processing and BI. Qualifications:  Tertiary education in Computer Science, Data Science, or a related field.Minimum of 10 years of experience in BI data, focusing on data processing methods and platforms.Prior experience in legacy data processing tools such Microsoft Batch Scripting and Microsoft Task SchedulerStrong knowledge of the latest data tooling, including the Microsoft Data Platform (Fabric)Experience in transitioning from legacy tooling is highly desirable.Proficiency in programming languages, including Microsoft SQL, Visual Basic, Python, etc.Expertise in data visualization tools (e.g., Tableau, Power BI).Familiarity with modern data platform concepts including (but not limited to): Data Ingestion (ETL, ELT, zero-ETL, Batch, Streaming), Data Storage (Warehouse, Lake, Lake-house) and Processing (Flows, Pipelines), Data Transformation and Modelling (SSIS,  Semantic layering), Data Observability (Freshness, Lineage, Providence), Data Discovery, Access Management (Federated AD).Experience in Machine Learning and AI.Proficiency in Microsoft Office 365 Suite.Prior experience with SAP or other ERP systems is a plus.Extensive knowledge of data reconciliation, validation, and quality frameworks.Ability to work with multiple relational data sources efficiently.Proven ability to create comprehensive documentation.Experience in the professional services sector is preferred.Familiarity with data governance practices, regulatory compliance, and data security standards is advantageous. Competencies: Strong problem-solving skills and data analysis capabilities.Proven track record and significant experience in navigating the complexities of a global organizational landscape.Proven project management experience.Flexibility to collaborate globally across time zones.Excellent interpersonal and communication skills.Ability to manage key relationships and work independently on multiple projects with deadlines.Ability to effectively communicate acros",London,False,True,,
"Backend Developer, Java Spring AI Software"," Backend Developer, Java Spring (AI Software) 70,000 - 80,000  Progression  Fully WFH Remote / London Are you a Backend Developer looking to join a thriving pioneer of artificial intelligence video analytics (A.I.V.A.) that are working on the latest advancements of AI Software and are at the forefront of innovation in the UK?  Do you want the opportunity to work on software used by government bodies, manufacturing companies and casinos to regulate CCTV footage with a hybrid engine for AI patented by this up-and-coming computer vision department? On offer is a once in a lifetime opportunity to join a growing team of highly skilled developers with a common goal, working on projects that span across the globe and have influence on our society as it develops into the next generation of technology. In the role, the Backend Java Developer will be working within the Spring framework on A.I.V.A. software for projects that enable the success of traffic, airports and business. Having full autonomy on your code you will check in occasionally with the wider  team to communicate developments and fixes being made. This role would suit a technically proficient developer with expertise in Java looking for a career in a meaningful organisation. THE ROLE:  Working on highly technical productsFixes bugs and troubleshooting issuesDeveloping software with Java (Spring) on the backend THE PERSON:  Experienced Java DeveloperProficient in RabbitMQ and ElasticsearchStrong background in Test-Driven Development (TDD) Keywords: Java, Software Developer, Full Stack Developer, Developer, Backend Developer, Developer, AI Development. Reference Number: BBBH11989 If you're interested in this role, click 'apply now' to forward an up-to-date copy of your CV. We are an equal opportunities employer and welcome applications from all suitable candidates. The salary advertised is a guideline for this position. The offered renumeration will be dependent on the extent of your experience, qualifications, and skill set. Ernest Gordon Recruitment Limited acts as an employment agency for permanent recruitment and employment business for the supply of temporary workers. By applying for this job, you accept the TC's, Privacy Policy and Disclaimers which can be found at our  website. ",London,False,True,,70000.0
Head of Finance- Series-B AI Startup," Head of Finance- Series-B AI Startup 80,000 - 100,000  benefits London, Hybrid TalentEdge are currently representing a cutting-edge AI startup based in London, dedicated to pushing the boundaries of technology and innovation.As they continue to grow and scale, theyare seeking a talented and experienced technically facing Head of  Finance to support thefinance function and support theirambitious goals. They are looking for an exceptional Head of Finance to overseethe financial reporting and technical accounting functions. Reporting directly to the VP Finance, the Head of Finance will play a pivotal role in ensuring the accuracy and integrity offinancial  data and providing insights to support decision-making. The ideal candidate will have a strong background in financial reporting and technical accounting, with experience working in a scaling tech company. Key Responsibilities:  Lead the financial reporting process, including the preparation of monthly, quarterly, and annual financial statements in accordance with GAAP and other applicable accounting standards.Manage the technical accounting function, providing guidance and expertise on complex accounting issues, including revenue recognition.Develop and maintain financial policies, procedures, and documentation to ensure compliance with regulatory requirements and internal controls.Drive continuous improvement initiatives to enhance the efficiency and effectiveness of financial processes and systems.Partner with cross-functional teams, including Sales, Marketing, and Engineering, to provide financial insights and support strategic decision-making.Support financial planning and analysis activities, including budgeting, forecasting, and variance analysis, to support business growth and profitability.Manage relationships with external auditors, tax advisors, and other financial service providers, ensuring timely and accurate completion of audits and tax filings.Provide leadership and mentorship to the finance team, fostering a culture of excellence, collaboration, and continuous learning. Qualifications and Skills:  Fully qualified accountant (ACA, ACCA, CIMA, or equivalent) with extensive post-qualification experience in financial reporting and technical accounting.Proven experience working in a scaling tech company or startup environment is highly desirable.Strong knowledge of GAAP and IFRS accounting standards, with expertise in complex accounting topics.Excellent analytical and problem-solving skills, with the ability to interpret financial data and provide strategic insights.Strong communication and interpersonal skills, with the ability to collaborate effectively with internal and external stakeholders.Proactive and results-driven with a focus on driving continuous improvement and operational excellence.Ability to thrive in a fast-paced and dynamic environment, with a passion for innovation and technology. This is an exciting opportunity to be part of a pioneering AI startup at the forefront of innovation. As the Head of Finance, you will have the chance to shape the financial strategy of the company, drive strategic decision-making, and contribute to their  continued success and growth. If you are a strategic and forward-thinking finance leader with a passion for technology and innovation, we encourage you to apply. ",London,False,True,,80000.0
Technology Lead - AI Start Up - Remote/London," The Company Our client, is a pioneering startup dedicated to revolutionising the landscape of AI integration, particularly in the domain of Large Language Models (LLMs). Their mission is to enhance the speed, simplicity, and cost-effectiveness of incorporating AI into  software solutions. With a compelling proof of concept already in place, their beta platform is set to launch in Q1. This groundbreaking platform empowers SaaS companies to seamlessly integrate LLM AI into their software, resulting in a remarkable 70% reduction  in both integration costs and time. Backed by a robust investment from a mid-sized corporate entity, our client is at the forefront of innovation in AI technology. The Role Our client seeks a dynamic and highly-skilled Technology Lead to spearhead their efforts. The ideal candidate should possess expertise in backend support, REST APIs, web security, and proficiency in Python and SQL. As the Technology Lead, you will play a  pivotal role in engaging with clients on technical matters, articulating the functionality of the product, and leading a remote team of experts in AI. If you are passionate about technology, boast excellent communication skills, and have a proven track record of successfully steering SaaS, web-based, and database projects, we invite you to be part of a visionary team. This is a unique opportunity to contribute  to cutting-edge advancements in AI integration while working with a well-funded and forward-thinking startup. Join a business that gives you an opportunity to be a driving force in shaping the future of AI technology. Key Responsibilities:    Elevate the standard of code quality by meticulously maintaining and reviewing the work produced by the remote coding team.Institute best practices to ensure the highest level of efficiency and effectiveness in the codebase.Engage with clients to proactively identify opportunities for feature enhancements, driving continuous improvement in the products.Collaborate closely with clients, translating their needs into innovative features that exceed expectations.Take a lead role in the technical facets of the sales process, adeptly communicating with developers on the client-side.Showcase the technical prowess of the solutions, instilling confidence in potential clients about the value and capabilities of the client's offerings.Foster collaboration with cross-functional teams to deeply comprehend project requirements.Deliver backend solutions that are not just functional but are scalable, efficient, and reliable, aligning with project objectives.Act as a bridge between technical and non-technical stakeholders, gathering and analyzing requirements with precision.Articulate technical concepts in a clear and compelling manner, ensuring effective communication across diverse team members.Proactively stay abreast of emerging technologies and industry trends, integrating relevant advancements seamlessly into the development process.Drive innovation by exploring and implementing cutting-edge solutions that position our products at the forefront of the industry.These responsibilities reflect our commitment to excellence, client satisfaction, and staying at the forefront of technological innovation. Join us in shaping the future of our products and the industry.  Qualifications:    Hold a Bachelor's or Master's degree in Computer Science, Information Technology, or a closely related field, showcasing a strong academic foundation.     Demonstrate a track record of successful leadership and project management in a Technology/Team Lead role, highlighting your ability to drive teams towards excellence.     Showcase expertise in backend support, underscoring your proficiency in crafting robust, efficient, and scalable backend solutions.     Possess a willingness to learn and adapt, with or without prior experience in Large Language Model (LLM) integration and optimization. We prioritize your ability to absorb and apply knowledge, which can be facilitated through training with our remote AI  coding team.     Exhibit advanced skills in Python and SQL, emphasizing a commitment to developing scalable and maintainable backend solutions that stand the test of time.     Display excellent communication skills, showcasing your capability to articulate intricate technical concepts to diverse audiences, fostering a clear understanding among team members.     Demonstrate strong problem-solving skills, illustrating your efficiency in troubleshooting and resolving issues with a strategic mindset.     Exhibit familiarity with agile development methodologies, emphasising your ability to thrive in dynamic and collaborative work environments.  Morgan McKinley is acting as an Employment Agency and references to pay rates are indicative. BY APPLYING FOR THIS ROLE YOU ARE AGREEING TO OUR TERMS OF SERVICE WHICH TOGETHER WITH OUR PRIVACY STATEMENT GOVERN YOUR USE OF MORGAN MCKINLEY SERVICES. ",London,False,True,,50000.0
