Job Title,Job Description,Location,Part-time,Full-time
UX Engineer," To further our expansion, we are now recruiting for a UX Designer to play a prominent role in our UX Team, producing designs for our award-winning platforms.You will be tasked with analysing and interpreting requirements and using your skills in sketching, wireframing and prototyping to produce interface designs that align with the business goals of providing delightful experiences for our users.Including: -  Leading Design Projects: Taking ownership of specific design projects, overseeing the entire process from initial research to final implementation.Turning Ideas into Wireframes and Prototypes: Translating concepts into tangible design assets, creating both wireframes and interactive prototypes to visualize and test design solutions.Coordinating with Developers: Collaborating closely with development teams to ensure design specifications are understood and implemented accurately, addressing technical constraints as needed.Managing Design Iterations: Overseeing the iterative design process, making data-driven decisions and continuously refining designs based on user feedback and testing.Contributing to Design Systems: Working within established design systems or contributing to the development and maintenance of new design guidelines and component libraries.Conducting User Research and Usability TestingParticipating in Multi-Disciplinary Teams: Working within diverse teams that may include developers, marketers, content strategists, and other specialists, ensuring a unified approach to product development.Engaging with StakeholdersBe an advocate for UX in the wider business looking for opportunities to showcase UX, via blog posts, chances to talk and proactive workshops that are not on the product roadmap.Provide help and assistance to junior members of the team.Contribute to the weekly UX Collective. About you:  Naturally creativeConfident communicatorStrong collaboration skillsPassionateTroubleshooting and problem-solving skills Knowledge  Skills  Minimum 2-3 years’ experience in a UX roleSolid prototyping software knowledge (Figma, XD etc)Expertise in User-Centred DesignUnderstanding of Visual Design PrinciplesAccessibility ExpertiseKnowledge of Current UX/UI TrendsAdaptable and keen to learnNaturally inquisitiveSelf-motivated and ambitious About us: AJ Bell is one of the fastest-growing investment platform businesses in the UK offering an award-winning range of solutions that caters for everyone, from professional financial advisers, to DIY investors with little to no experience. We have over 484,000  customers using our award-winning platform propositions to manage assets totalling more than 76.2 billion. Our customers trust us with their investments, and by continuously striving to make investing easier, we aim to help even more people take control of  their financial futures. Having listed on the Main Market of the London Stock Exchange in December 2018, AJ Bell is now a FTSE 250 company. Headquartered in Manchester with offices in central London and Bristol, we now have over 1300 employees and have been named one of the UK's 'Best 100 Companies to Work For’ for six consecutive years. What we offer:  Generous holiday allowance increasing up to 31 days with service, plus bank holidaysHoliday buy/sell schemeHybrid working policyCasual dress codeDiscretionary bonusContributory pension schemeHealthcare Cash PlanDedicated time for proof-of-concepts and assessing new techSupport to attend conferences, events, and meet-upsBuy as you earn share schemeFree annual share schemePaid study support for qualificationsEnhanced maternity/paternity scheme from day oneBike loanSeason ticket loan portalDiscounted PMI and DentalFree gymPaid volunteering opportunities, free social events and more AJ Bell is committed to providing an environment of mutual respect where equal employment opportunities are available to all applicants and all employees are empowered to bring their whole self to work. We do not discriminate on the basis of race, sex, gender identity, sexual orientation, age, pregnancy, religion, physical and mental disability, marital status and any other characteristics protected by the Equality Act 2010. All decisions to hire are based  on qualifications, merit and business need. ",Manchester,False,True
UX Product Designer," Are you an experienced, creative, and analytical designer with a solid grasp on disciplines ranging from research, analysis, ideation, facilitation, pixel-perfect design, prototyping, and user testing? Would you like to be part of both an ambitious but informal UX  Design team working strategically on the end2end user journey, and also be situated very closely to the development in a developer team, where you have the main responsibility for product design  of some of our key digital offerings and will be part of digitally transforming our ferry  terminals business? ?If so – Great, we might have a match! Be part of the movement – and play your part. About the role You will be working on the product belonging to your developer team in the Ferry  Terminals (FT) part of DFDS, but will also collaborate and coordinate with the other DFDS UX and UI Designers that are based in Copenhagen to harvest the synergy between  your respective domains, and make sure that we are all pulling in the same direction. As this collaboration will be largely undertaken remotely this role will not suit everyone. However, if you are motivated for the challenge, we will assist by providing the  opportunity to travel periodically to Copenhagen to build rapport and work with colleagues in the UX  Design Team. There are currently 7 skilled, and friendly international UX Designers, a well-rounded UX Researcher, two talented UI Designers who develop and mature our Figma-based design system Hydro, and a UX Team Lead who works strategically with upper management to make  sure that UX is part of the process. You will be responsible for:  Collaborate closely with the System/Business Analyst in your development team on what and how to test to inform needs for your FT based productAnalyse data and synthesise relevant insightsIdeate on solutions in collaboration with e.g. your developer team, Architects, and stakeholders from the business?Produce wireframes and pixel perfect designs in Figma using our design system Hydro to create strong deliveries for developersMake sure user tests of new designs and features is carried outCommunicate insights to relevant people, both in the UX  Design Team and to other stakeholders in DFDS  About you We think the strongest teams are built on diversity and inclusivity. Contrasting opinions, varied skills and strong characters bring out the best in us all. With this in mind, we think that you as a person would be a great fit if you are a proactive self-starter,  and a strong finisher, who can take initiative and take responsibility for getting things done. You are analytical and can see the bigger picture, but still have a great eye for details and coherence. You are a team player who values collaboration and can  give and receive constructive feedback on designs. The ideal person for this position will have the following qualifications:  Has 2 years of professional experience as a UX/UI Designer from either in-house or agency setups?and has been responsible for creating designs that support a great user experience that converts.Is a self-starter and can cover the UX process end2end.Has very strong UI skills and solid experience working with prototyping tools, like Figma or Sketch, which is demonstrated in their portfolio.Has a strong grasp on qualitative and quantitative methodologies and is data-driven and data literate.Is a strong communicator who knows how to provide sound rationales for design decisions to a variety of disparate stakeholders, and is fluent in English, both written and spoken as it is DFDS ´corporate language.Experience working in a Scrum team, and/or within a bigger international organization.  Working at DFDS Join the movement and grow with us. Be a valued member of a diverse team at DFDS and help drive change together. While you’re with us, we want you to develop. At DFDS, we believe that development happens first and foremost through activities in the workplace. We will also offer training courses that can support you in your role, if needed. Now about what we can give you. You’ll be able to access some fantastic benefits such as:  Life assurance coverContributory company pension schemeHoliday Purchase SchemeFree ferry travel for up to 4 guests between Dover and Calais / Newcastle and Amsterdam with no limit on tripsFull employee assistance programme including:Proactive financial, emotional, mental, and physical health care support including face to face counselling, fast 24/7 access to a GP, a second medical opinion and legal support for colleagues and their family.Huge range of retail discounts from high street and online retailersCashback on health care including dental, optical, physiotherapy, prescriptions, specialist consultations and much more.Access to Thrive, our award-winning Wellbeing platform.Access to mental health first aid and opportunity to join support webinars with a focus on all areas of positive wellbeing. Are we a match? Then what are you waiting for? Apply now. If you think your personality, skills, experience, and desire match this role, we’d love to hear from you. Please send us your CV as soon as possible, as we’re keen to meet potential candidates on an ongoing basis. We look forward to hearing from you. ",Grimsby,False,True
Senior UX Designer," Reporting Line: Head of Digital Experience  InnovationContract Type: PermanentLocation: Wood Street, LondonClosing Date: 5th April 2024 What to expect We have a great new role in our Digital Experience team, as a Senior UX Designer. You will be responsible for defining and designing the customer experience of products and services within the business. You’ll thrive solving real-world, complex problems  for customers, and be ambitions and passionate about designs role in creating products and services that customers love. You will be working closely with Product Managers, Researchers, Visual Designers, Developers, and technology teams to enhance the customer experience, driving both acquisition and engagement in the process to aid commercial success for Post Office Limited   enhance remuneration for Postmasters. As well as interacting with your direct peers in the CX department, you’ll be pulling-in key stakeholders from across the business to support in workshopping and blueprinting of their products and services. You’ll draw  on your senior experience to support and mentor other designers, and provide the necessary scrutiny to ensure Post Office’s design and experience standards are upheld. What we can do for you Now, more than ever, we understand that attracting the right talent is pivotal in driving the positive change needed throughout our organisation. Beyond a competitive salary, we offer a comprehensive benefits package that includes:  27.5 days annual leave that increases with tenure Up to 18% individual performance-based incentive schemeCar allowance Generous pension contributionLife assuranceIncome protection after 12 months serviceFull support from our employee assistance programme and access to our employee benefits platform Ever-evolving learning and development opportunities Our commitment to embracing diversity extends beyond just words. We actively foster an inclusive workplace that values the unique perspectives and contributions from all colleagues. We hold the belief that Equity, Diversity, and Inclusion are not just vital  but fundamental to our success and growth. Our priority lies in shaping a business that mirrors the diverse communities we reach, truly making Post Office 'Everybody's Business'. As an equal opportunity employer, we value and celebrate the differences among  our people, ensuring that our practices reflect our dedication to inclusivity and equal representation for all. What you’ll need to succeed  Demonstrable experience working as a Senior UX Designer on end-to-end journeys for digital products and services, and across the customer lifecycle, with a strong understanding of user-centred, service, and design thinking methodologiesExperience ideating, designing, and creating service standards for experiences across the customer lifecycle, in digital, retail, CRM, and contact centresAbility to own a project’s design activities from initial discovery through to delivery, with support from Design Lead and Head of User Experience  DesignPossess a passion for all things design and all things customer Demonstrable ability to implement design and show return on investmentProficient skills in prototyping and mapping tools to varying levels of fidelity (e.g. Figma, Axure, InVision, Sketch, Marvel, Adobe CC)Senior experience in interaction designDeep understanding of experience architecture, with demonstratable experience identifying and interpreting complex problems, and mapping the processes and outputsAbility to iterate quickly and refine solutions, while rationalising decisions against business requirementsProven experience of using data and insight to influence design decisionsMotivated self-starter; problem solver who enjoys creating something new Planning, organisational, and time management skills, with the ability to manage and prioritise own workloadA strong portfolio demonstrating design thinking, with examples of product design and experience across the customer lifecycleStrong understanding of accessibility standards (PSBAR understanding is also beneficial)Experience of working in an Agile/Scrum environment About us Post Office is an integral part of every community, upheld by the dedication and service of our postmasters. In a world that's constantly evolving, we recognise the importance of adapting and growing. As we navigate the shifting landscapes of a digital age,  our commitment to evolving is stronger than ever; without losing the essence of personal touch that defines us. Our journey forward is one of reflection, learning, and positive change. Whilst there is much work to be done, we're looking for people ready to think differently in tackling the challenges ahead - people who possess resilience and a deep sense of responsibility towards our postmasters and the communities they serve. This mission  drives us, ensuring that we remain focused on our purpose and strategic intent. If you're inspired by the prospect of making a meaningful difference and contributing to a future where Post Office can stand as a model of renewed progress and integrity, we want  to hear from you. Join us on our journey in making Post Office a business that belongs to and serves everyone, shaping a new future legacy. ",City of London,False,True
Visual UI Designer," Salary: Competitive salary  benefitsGrade: 3AReporting Line: Design LeadContract Type: PermanentLocation: Wood Street, LondonClosing Date: 27th March 2024 What to expect A wonderful role in our Digital team is now available. You will be responsible for setting the visual design standard for new digital products within the business.  You will be working closely with other Visual Designers, UX Designers, User Researchers, Product Managers, and Developers to enhance the customer experience, driving both acquisition and engagement in the process to aid commercial success for Post Office  Limited  enhance remuneration for Postmasters.  In your capacity you’ll act as a key escalation point for visual design decision making, carefully assessing how, why, and when to craft and refine new design paradigms across our products.  What we can do for you Now, more than ever, we understand that attracting the right talent is pivotal in driving the positive change needed throughout our organisation. Beyond a competitive salary, we offer a comprehensive benefits package that includes:  27.5 days annual leave that increases with tenure Up to 18% individual performance-based incentive schemeCar allowance Generous pension contributionLife assuranceIncome protection after 12 months serviceFull support from our employee assistance programme and access to our employee benefits platform Ever-evolving learning and development opportunities Our commitment to embracing diversity extends beyond just words. We actively foster an inclusive workplace that values the unique perspectives and contributions from all colleagues. We hold the belief that Equity, Diversity, and Inclusion are not just vital  but fundamental to our success and growth. Our priority lies in shaping a business that mirrors the diverse communities we reach, truly making Post Office 'Everybody's Business'. As an equal opportunity employer, we value and celebrate the differences among  our people, ensuring that our practices reflect our dedication to inclusivity and equal representation for all. What you’ll need to succeed  Demonstrable experience working as a visual/UI designer on digital products and services with a strong portfolio demonstrating your meticulous attention to detailProficient skills in Figma and common design tools such as Sketch, and Adobe CCStrong design skills and eye for detail, with a good understanding of typography, intuitive layouts and palate developmentExperience with different platforms but specifically responsive web. Mobile app UI design experience an advantageAbility to iterate quickly and refine solutions, while rationalising decisions against business requirementsPossess a passion for all things design and all things customer Motivated self-starter; problem solver who enjoys creating something new Experience of working in an Agile/Scrum environment with a focus on fast-paced delivery Contributing relevant development of and maintaining updates to UI style guides and asset libraryExperience in fintech and development/programming if even at a simple level, desirable About us Post Office is an integral part of every community, upheld by the dedication and service of our postmasters. In a world that's constantly evolving, we recognise the importance of adapting and growing. As we navigate the shifting landscapes of a digital age,  our commitment to evolving is stronger than ever; without losing the essence of personal touch that defines us. Our journey forward is one of reflection, learning, and positive change. Whilst there is much work to be done, we're looking for people ready to think differently in tackling the challenges ahead - people who possess resilience and a deep sense of responsibility towards our postmasters and the communities they serve. This mission  drives us, ensuring that we remain focused on our purpose and strategic intent. If you're inspired by the prospect of making a meaningful difference and contributing to a future where Post Office can stand as a model of renewed progress and integrity, we want  to hear from you. Join us on our journey in making Post Office a business that belongs to and serves everyone, shaping a new future legacy. ",City of London,False,True
Senior Graphic Designer," 35,000 - 40,000 plus bonusesKnowle Village, Fareham PO17 5LFHybrid working: 3 days office-based; 2 days home-based We’re Point Thirteen Media: a design, marketing and recruitment advertising agency that’s going places. Helping our clients flourish is our MO, and we do this by delivering multi-platform solutions at lightning speed and with great pride. We’re looking for a Senior Graphic Designer to join our digital team - someone that will impart flair, creativity and ideas into the department to support its growth and development while stunning our clients with your work. Talking of which, our clients are diverse, from large NFPs running cross-platform social media campaigns to small, rural independent schools seeking candidate information brochures for their next hire. We’ll look to you to be able to swiftly switch between  assignments and adapt your design style to suit the hundreds of clients we work with. We’re proud to hold Google and Meta partnership status, and much of the work our design team produces is for paid-for social media ads, so you’ll need to be confident in that arena, as well as brochure builds and microsite creation. To shine in this role, you will:  Have significant experience as a well-rounded senior designerBe fully versed in After Effects, Illustrator, InDesign and PhotoshopHave knowledge of coding HTML and CSS, along with experience of WordPressHave experience of open-source clients such as CyberduckBe comfortable taking and interpreting briefs, delivering exciting solutionsBe confident juggling diverse projects and managing tight timescalesBe adept in bringing account handling and creative colleagues together In return, you’ll join a friendly team and enjoy a challenging and diverse workload. You’ll also benefit from:  Hybrid working (Tue, Wed  Thur office-based; Mon  Fri home-based)A unique office environment in our converted chapelCareer development opportunitiesUp to 28 days’ annual leave plus bank holidaysA climate-positive workforceStaff reward daysPerformance-related incentivesChildcare vouchersCycle2Work schemeFree parking Next steps… Click to apply where you’ll be taken to our website to learn more. ",Knowle,False,True
User Interface Developer," User Interface Developer / Southampton /  80 per hour Our client, a leading Aerospace and Defence Organisation are currently recruiting for a User Interface Developer at their site in Southampton. As a Software Engineer with a User Interface Focus, you will work alongside a small team of skilled software engineers  and collaborate with a diverse multidisciplinary engineering team. You will be instrumental in designing and developing solutions for challenging applications that demand high performance and integrity. From conception to deployment, you'll play a pivotal  role in the full development lifecycle, ensuring that solutions meet and exceed expectations.  Responsibilities:  Develop software solutions using:  CJavaScript (React)Node.js Work on full stack development projectsUtilise version control (Git) effectivelyCollaborate with multidisciplinary engineering teams Requirements:  Proficiency in C, JavaScript, React, Node.jsExperience with Windows and Linux environmentsFull stack development expertiseKnowledge of version control (Git)Security Clearance requiredOn-site interaction with the team and hardware Nice to Have:  Familiarity with HTML/CSS, C#, JavaUnderstanding of databases (PostgreSQL, MySQL, etc.)Experience with Agile methodologiesKnowledge of front-end web development frameworksFamiliarity with embedded development, visualisation technologies, and networking principles This is a one year temporary role with the potential to extend.Site based, Monday to Friday 37 hours per week. Software Engineer (User Interface Focus)Frontend DeveloperUI/UX DeveloperApplication Developer (with UI specialisation)Interface Design EngineerUI Architect Kelly Services are acting as an Employment Business in relation to this role. Should you choose to apply, your information will be processed in accordance with Kelly's Privacy Statement. For information regarding data protection at Kelly, please visit the  Kelly website and have a look into the Privacy Statement.  As an Equal Opportunities employer we welcome applications from all suitably qualified persons regardless of their race, sex, disability, religion/belief, sexual orientation or age. ",Southampton,False,True
