Job Title,Job Description,Location,Part-time,Full-time
UX Designer," . Robert Half are recruiting for a UX Designer at a Market-Leading Digital Transformation Company in Bristol! Are you a talented UX Designer looking for an exciting opportunity to make an impact in the world of digital transformation? Our client, a market-leading company based in Bristol, is seeking a passionate and innovative individual to join their dynamic team. About the Role: As a UX Designer, you will play a pivotal role in shaping the user experience for cutting-edge digital products and services. Working alongside a talented team of professionals, you will be responsible for:  Conducting user research to gain insights into user behavior and preferences.Creating wireframes, prototypes, and user flows to visualize design concepts.Collaborating with cross-functional teams to translate business requirements into intuitive and user-friendly designs.Iterating on designs based on feedback from stakeholders and user testing.Ensuring consistency and usability across multiple platforms and devices. Requirements:  Proven experience as a UX Designer, with a strong portfolio showcasing your design work.Proficiency in design tools such as Adobe XD, Sketch, or Figma.Solid understanding of user-centered design principles and best practices.Excellent communication and collaboration skills, with the ability to work effectively in a team environment.Bachelor's degree in Design, Human-Computer Interaction, or related field. How to Apply: If you're ready to take your career to the next level and be part of an exciting journey in digital transformation, we want to hear from you! Please submit your resume and portfolio or visit our website to learn more about this exciting opportunity. Robert Half Ltd acts as an employment business for temporary positions and an employment agency for permanent positions. Robert Half is committed to equal opportunity and diversity. Suitable candidates with equivalent qualifications and more or less experience  can apply. Rates of pay and salary ranges are dependent upon your experience, qualifications and training. If you wish to apply, please read our Privacy Notice describing how we may process, disclose and store your personal data: gb/en/privacy-notice Security alert: scammers are currently targeting jobseekers. Robert Half do not ask candidates for a fee or request candidates to send applications through instant messaging services such as WhatsApp or Telegram. Learn how to protect yourself  by visiting our website: gb/en/how-spot-recruitment-scams-and-protect-yourself ",Bristol,False,True
UX/UI Designer  EU," Ecommerce Platform - Scale up - UX/UI We are currently partnering with a leading retail technology business specialising in innovative solutions for ecommerce platforms and Point of Sale (POS) systems. With a focus on enhancing the retail and restaurant experience, they empower businesses to  thrive in the digital marketplace.  They are now looking for a UX/UI Designer to join them as they start to scale. The UX/UI Designer will be responsible for designing intuitive and visually appealing user interfaces for their ecommerce platform and POS systems. Ideally they are looking for  3 years as a UX/UI Designer, with a portfolio showcasing your design process and projects related to ecommerce platforms and/or POS systems. Tech Stack Expertise:   Utilise design tools and software, such as Adobe XD, Sketch, or Figma, to create high-fidelity designs and prototypes.  Familiarity with the tech stack used on their ecommerce platform (Magento) and mobile app (Flutter) to ensure design feasibility and compatibility.  This is an opportunity to be part of a collaborative and innovative work environment where your contributions and ideas are valued and recognised. This is a remote role paying up to 70,000 euros.  ",Spain,False,True
UX Designer," UX Designer with a proven track record of delivering cross platform (web, mobile, platform) design whilst considering the wider user impact is sought by a market leading, ethical FinTech based in Birmingham city centre. This UX Designer will be joining a team of 6 multi disciplinary digital professionals who are entering an exciting phase of growth affording this UX Designer great day to day variety in an autonomous forward-thinking environment. On a day to day this UX Designer will use their wide range of UX research experience and cross platform design skills to not only add new energy and direction to existing web projects but also act as a key stakeholder working closely with the development and  senior management team to ensure a clear design strategy for an upcoming greenfield customer platform project. This UX Designer should have most of the following key skills: - Exposure to concept creation tools - Figma, Balsamiq, Invision, Adobe Creative suite etc - A strong portfolio of user centric, responsive and well researched design - Previous experience delivering an AB/multi variate testing program - A real passion for working in a scrum driven, agile team - A solid understanding of UX best practice across web and mobile - A wider appreciation of current design trends - Stakeholder management experience - Any experience working in a FinTech would be a real plus In return for your hard work this UX Designer will receive: - Starting salary of 60,000 - 70,000 DoE - Long term remote working - Bonus scheme - Flexible working patterns - 25 days holiday - Choice of technology - Personal development time allocation - A relaxed, inclusive working environment - Regular salary reviews - A well-structured progression scheme in line with the company's expansion plans So if you UX Designer and want to play a lead role in the design output of a international brand then please click 'APPLY NOW'. Birmingham 60,000 - 70,000 DoE UX Designer - User research, Photoshop, User Experience, AB testing, Adobe XD Wireframing , agile, scrum, responsive, mobile, FinTech, Figma ",Birmingham,False,True
UX Designer," We're looking for a talented UX designer to join our growing experience design team. You'll be playing a key part in an ambitious team, working with a wide variety of high-profile brands across a diverse mix of design briefs. The perfect candidate will have excellent attention to detail and be brilliant at seeing simple answers to complicated experience design challenges. You'll know and practise industry-standard user-experience design techniques and processes and will have a user-centred design portfolio, showing a broad range of design ideas backed up with data to prove their effectiveness. What you can expect:  Employee wellbeing initiatives25 days holidayWorking hours Monday to Friday, 37.5 hours a week 9.00am - 5.30pmHybrid working Duties and responsibilities:  Creating wireframes, customer journey maps, site maps and plan-view diagramsBuilding digital and physical prototypes with pace and accuracyDesigning engaging experiences which meet customer needsCollaborating with the wider creative team to define, shape and implement effective customer journeysPlan and facilitate client workshops and design sprints Skills and experience required:  Extensive design industry experience within an agency environmentAbility to create engaging experiences across UX, product, service, and spatial designExperience of service design would be an advantage but not essentialA strong understanding and belief in human-centred design thinking, methods, and techniquesAbility to problem-solve and find the most effective answerExcellent attention to detailProficiency in Figma, Sketch, Adobe CC and related prototyping toolsAbility to present confidently and with enthusiasm to design teams and clientsFull UK driving licence ",Mansfield,False,True
Senior UI/UX Designer," SENIOR UX/UI DESIGNER UP TO 65,000-70,000  BENEFITS LONDON (CENTRAL) This is an exciting opportunity to work as a Senior UI/UX Designer for an innovative, well-backed FinTech that are currently revolutionising their market. This is a new development set up by entrepreneurs from world-leading technology platforms who have  a track record for advising some of the world's largest companies. The interview process will involve a short introductory conversation with 2 Product Leads, 1 conversation with a Founder and an in-person case study to get a good feel for the companies excellent culture. THE COMPANY The successful Senior UI/UX Designer will have the opportunity to work within an excellent company culture, who are looking to create industry-leading FinTech solutions on their App. This company has taken a new approach to their market, as they are seeing  great success whilst redefining how families engage with and manage their financial life. This company is backed by some of the most influential business leaders and institutions across Europe, having raised substantial funding to support their exponential growth.  THE ROLE As a Senior UI/UX Designer, you will be involved in designing slick, user-friendly products that have seamless interfaces. More specifically you can expect to be involved in the following;  Develop high-quality user interface designs, prototypes, and interactive mockups for nativemobile and web applicationsLead the creation and implementation of new design systemsConduct user research, gather feedback, and iterate on designs based on user insights tocontinually improve the app's user experienceCollaborate closely with cross-functional teams, including developers and product managersPromote best practice in UI and UX design and design processesStay up-to-date with the latest iOS and Android design guidelines and best practices  YOUR SKILLS AND EXPERIENCE The successful Senior UI/UX Designer will have the following skills and requirements;  Highly experienced in native app (iOS and Android) and web-app UX and UIHighly experienced in creating and implementing mobile design systemsStrong knowledge of iOS and Android design patterns, guidelines, and best practices to ensureoptimal user interactions including SwiftUI and M3Strong proficiency in Figma best practiceA comprehensive portfolio showcasing your proficiency in both mobile and web-app UX/UIdesignStrongly motivated, sets demanding standards of personal excellenceEager to learn complex financial concepts  THE BENEFITS The successful Senior UI/UX Designer will receive a salary up to 70,000 as well as an extensive benefits package incl. options. Alongside this, it is an excellent opportunity for a self-motivated, innovative individual that is looking to take ownership  of multiple product projects whilst working autonomously in an amazing company. The interview process will consist of 3 stages - 2x initial video conversations and a face to face. HOW TO APPLY: Please register your interest by sending your CV to Dylan Butcher via the Apply link on this page. ",London,False,True
UI Designer," UI Digital Designer - with Webflow Expertise We are seeking a Mid-weight UI Designer with expertise in Webflow to join our client's dynamic team. The ideal candidate will collaborate closely with their creative disciplines, contributing to brand strategy and identity design, website UI design (no-code  development), and UX/UI digital product design. Key Responsibilities:  Collaborate with the creative team on brand strategy and identity design.Design visually appealing and user-friendly website UI using Webflow.Contribute to UX/UI digital product design, ensuring seamless user experiences.Embrace challenges with a proactive approach, taking ownership of projects. Location: Hove (5-minute walk from the beach) Hybrid working model (2 days in-office, 3 days remote). Salary: 35,000 - 40,000 Please make sure you send your portfolio alongside your CV. Creative Recruitment is an equal opportunity employer and do not discriminate based on race, religion, gender, age, sexuality, gender identification, or physical ability.  ",Hove,False,True
Senior UI/UX Designer," Senior UI/UX Designer Up to 70,000 Hybrid - London  A great opportunity to join an innovative financial tech company as a Senior UI/UX Designer  THE COMPANY  The business is an innovative financial tech company specialising in designing financial life strategies to help customers meet their ambitions and navigate important life changes. And they are currently working on developing their mobile app for android/iOS  and new products from scratch.  Joining their Product team as a Senior UI/UX designer, you will be responsible for helping develop the businesses products and implement new features.  THE ROLE  Coming into an established function looking at improving the UX/UI design. Alongside this, you have the exciting opportunity to build from scratch a new web platform that will better target their customer base. This role will report directly to the Head of Product and will work alongside other great Product Designers. YOUR KEY SKILLS AND EXPERIENCE    Proven track-record working in fast-paced, start-up environment  Technical experience in UI/UX Design (ideally in SwiftUI and M3)  Background in iOS, Android and Web development   THE BENEFITS    Up to 70,000  benefits  Hybrid  London   HOW TO APPLY If interested in the role please send your CV to Jordan Victor via the Apply Link below  ",London,False,True
Senior UI/UX Designer," Senior UI/UX Designer Up to 70,000 Hybrid - London  A great opportunity to join an innovative financial tech company as a Senior UI/UX Designer  THE COMPANY  The business is an innovative financial tech company specialising in designing financial life strategies to help customers meet their ambitions and navigate important life changes. And they are currently working on developing their mobile app for android/iOS  and new products from scratch.  Joining their Product team as a Senior UI/UX designer, you will be responsible for helping develop the businesses products and implement new features.  THE ROLE  Coming into an established function looking at improving the UX/UI design. Alongside this, you have the exciting opportunity to build from scratch a new web platform that will better target their customer base. This role will report directly to the Head of Product and will work alongside other great Product Designers. YOUR KEY SKILLS AND EXPERIENCE    Proven track-record working in fast-paced, start-up environment  Technical experience in UI/UX Design (ideally in SwiftUI and M3)  Background in iOS, Android and Web development   THE BENEFITS    Up to 70,000  benefits  Hybrid  London   HOW TO APPLY If interested in the role please send your CV to Jordan Victor via the Apply Link below  ",London,False,True
Senior UX/UI Designer," Job Title: Senior UI/UX DesignerContract Type: Permanent, (Full Time/ Part Time/ Job Share/Flexible opportunities available)Location: Remote with adhoc travel to our Bournemouth and Eastleigh officeSalary: 44,000-55,000 depending on experienceSenior UI/UX DesignerAgeas are on a journey of change, transforming our business to become a leading digital insurer which is what makes now the perfect time to join us! With great change comes the need for great people and with that in mind, our Digital team is expanding, and  we have a number of exciting opportunities where you can play a pivotal part in Ageas' digital transformation.Ageas UK have an exciting opportunity for someone to join our Marketing  Digital team as a Senior UX/UI Designer who will be responsible for delivering user experience and interface design along with the development of Ageas' online presence. Our Senior UI/UX  Designer will be accountable for the design of the digital customer experience journey, encompassing brochureware and full online application and transactional capability.To be successful in the Senior UI/UX Designer role, you will need a strong understanding of user experience and human-centred design methodologies to shape the online customer journey, as well as functions and features of web design.Please note: Most of your time will be spent working remotely, supported by necessary equipment, however adhoc travel to our Bournemouth office will be required on occasion.Here are some of the main responsibilities of the Senior UI/UX Designer opportunity:Ensuring that visitors to the Ageas website have a positive experience when visiting the customer facing portions of the site.Working collaboratively with the digital analytics team to find and optimise issues within the customer journey and manage a programme of multivariate testingEnsuring that functionality, site structure, information and architecture are aligned to a good customer experience.To run user testing sessions and conduct research to feed into the UX strategyCreating concepts, design and tests to ensure the customer journey and UI is best in class.Ensuring the Ageas site is compliant, accurate, on brand and meets TCF guidelines.Contributing to web projects e.g. implementation of promotional initiatives; addition of, or changes to, product offerings; changes to panel composition; price changes;Working with agile teams to implement, influence and manage change.Here are some of the key skills, experience and competencies required to be successful in the Senior UI/UX Designer roleMinimum 5 years experience as a user focused, end to end UX/UI designerExperience working with Agile and scrum teams (desired)Proven experience in the build, test and implementation of websitesAbility to analyse and interpret user journey stats and digital analyticsExpert knowledge of design toolsDemonstrable experience and know how in user researchExpert knowledge of UX principles and Interaction designKnowledge of 'best practise' usability function.An excellent verbal and written communicator, being able to present and explain designs and key milestones deliverables to peers and senior stakeholdersComfortable identifying and escalating risk where necessary.Here are some of the benefits you can enjoy within the Senior UI/UX Designer role:At Ageas we offer a wide range of benefits to support you and your family inside and outside of work, which helped us achieve, Top Employer status in the UK.Flexible Working - Smart Working @ Ageas gives employees flexibility around location (as long as it's within the UK) and, for many of our roles, flexibility within the working day to manage other commitments. We also offer all our vacancies part-time/job-shares  . We also offer a minimum of 35 days holiday (inc. bank holidays) and you can buy and sell days.Supporting your Health - Dental Insurance Health Cash Plan, Health Screening, Will Writing, Voluntary Critical Illness, Mental Health First Aiders, Well Being Activities.Supporting your Wealth - Annual Bonus Schemes, Annual Salary Reviews, Competitive Pension, Employee Savings, Employee Loans.Supporting you at Work - Well-being activities, Sports and Social Club events and more.Supporting you and your Family - maternity/pregnant parent/primary adopter entitlement of 16 weeks' at full pay and paternity/non-pregnant parent/co-adopter at 8 weeks' full pay.Benefits for Them - Partner Life Assurance and Critical Illness coverGetting Around - Car Salary Exchange, Cycle Scheme, Vehicle Breakdown CoverGet some Tech - Deals on various gadgets including Wearables, Tablets and Laptops.Supporting you back to work - Return to work programme after maternity leave About AgeasWe're one of the largest car and home insurers in the UK. Our people help Ageas to be a thriving, creative and innovative place to work, which is echoed in the service we provide to over four million customers.As an inclusive employer, we encourage anyone to apply. We're a signatory of the Race at Work Charter and Women in Finance Charter, a Stonewall diversity champion and a Disability Confident Employer (which means interviews are guaranteed for applicants with  a disability who meet the minimum role criteria). For more information please see Ageas Everyone.Our aim is to have great people everywhere in our business and we're always looking for outstanding people to join us. Most roles across Ageas allow a proportion of your time to be spent working from home and we're open to discussing flexible working, including  full-time, part-time or job share arrangements.To find out more about Ageas, see About Us.Want to be part of a Winning Team? Come and join Ageas.. ",Bournemouth,False,True
Graphic Designer," Job Title: Graphic DesignerSalary: Up to 40,000 DOELocation: Leicester Are you a creative and talented Graphic Designer with a passion for visual storytelling? We are on the lookout for a dynamic individual to join our client's team and contribute to the success of our clients' marketing campaigns. If you have a keen eye for design, a strong portfolio showcasing your skills, and a desire to work in a collaborative  and fast-paced environment, we want to hear from you! Responsibilities:- Collaborate with the marketing team to understand project requirements and objectives.- Create visually appealing and effective designs for various digital and print materials, including but not limited to social media graphics, website banners, brochures, and advertisements.- Stay up-to-date with industry trends and incorporate innovative design concepts into our projects.- Ensure brand consistency across all materials and platforms.- Work with clients to understand their design needs and deliver creative solutions that meet or exceed their expectations.- Manage multiple projects simultaneously and meet tight deadlines. Requirements:- Proven experience as a Graphic Designer with a strong portfolio showcasing a variety of design projects.- Proficiency in Adobe Creative Suite (Photoshop, Illustrator, InDesign, etc.).- Strong understanding of HTML5, CSS, and WordPress for web design purposes- Experience with video editing software such as Adobe After Effects is preferred- Excellent communication and collaboration skills.- Ability to take creative direction and work independently.- A keen eye for detail and a commitment to delivering high-quality work. Qualifications:- Bachelor's degree in Graphic Design, Visual Arts, or a related field.- 3 years of relevant work experience in a design role. If you are interested in this role, please apply for immediate consideration and interview, and to receive further details about the role. You can contact me on or  Key Words:Graphic Designer, Designer, Content Creator, Creative, Events, Sketchup, Adobe, Adobe Creative Suite, Illustrator, Photoshop, Adobe After Effects, Designer, Design, Graphic Design, Graphics, Digital, HTML, CSS In Technology Group Ltd is acting as an Employment Agency in relation to this vacancy. ",Leicester,False,True
Graphic Designer," Job Title: Graphic DesignerSalary: Up to 40,000 DOELocation: Birmingham Are you a creative and talented Graphic Designer with a passion for visual storytelling? We are on the lookout for a dynamic individual to join our client's team and contribute to the success of our clients' marketing campaigns. If you have a keen eye for design, a strong portfolio showcasing your skills, and a desire to work in a collaborative  and fast-paced environment, we want to hear from you! Responsibilities:- Collaborate with the marketing team to understand project requirements and objectives.- Create visually appealing and effective designs for various digital and print materials, including but not limited to social media graphics, website banners, brochures, and advertisements.- Stay up-to-date with industry trends and incorporate innovative design concepts into our projects.- Ensure brand consistency across all materials and platforms.- Work with clients to understand their design needs and deliver creative solutions that meet or exceed their expectations.- Manage multiple projects simultaneously and meet tight deadlines. Requirements:- Proven experience as a Graphic Designer with a strong portfolio showcasing a variety of design projects.- Proficiency in Adobe Creative Suite (Photoshop, Illustrator, InDesign, etc.).- Strong understanding of HTML5, CSS, and WordPress for web design purposes- Experience with video editing software such as Adobe After Effects is preferred- Excellent communication and collaboration skills.- Ability to take creative direction and work independently.- A keen eye for detail and a commitment to delivering high-quality work. Qualifications:- Bachelor's degree in Graphic Design, Visual Arts, or a related field.- 3 years of relevant work experience in a design role. If you are interested in this role, please apply for immediate consideration and interview, and to receive further details about the role. You can contact me on or  Key Words:Graphic Designer, Designer, Content Creator, Creative, Events, Sketchup, Adobe, Adobe Creative Suite, Illustrator, Photoshop, Adobe After Effects, Designer, Design, Graphic Design, Graphics, Digital, HTML, CSS In Technology Group Ltd is acting as an Employment Agency in relation to this vacancy. ",Birmingham,False,True
